-- phpMyAdmin SQL Dump
-- version 5.2.0
-- https://www.phpmyadmin.net/
--
-- Host: localhost:3306
-- Generation Time: Apr 17, 2023 at 12:30 AM
-- Server version: 5.7.33
-- PHP Version: 7.4.19

SET SQL_MODE = "NO_AUTO_VALUE_ON_ZERO";
START TRANSACTION;
SET time_zone = "+00:00";


/*!40101 SET @OLD_CHARACTER_SET_CLIENT=@@CHARACTER_SET_CLIENT */;
/*!40101 SET @OLD_CHARACTER_SET_RESULTS=@@CHARACTER_SET_RESULTS */;
/*!40101 SET @OLD_COLLATION_CONNECTION=@@COLLATION_CONNECTION */;
/*!40101 SET NAMES utf8mb4 */;

--
-- Database: `doorlock`
--

-- --------------------------------------------------------

--
-- Table structure for table `attendance_devices`
--

CREATE TABLE `attendance_devices` (
  `id` bigint(20) UNSIGNED NOT NULL,
  `uid` varchar(125) COLLATE utf8mb4_unicode_ci NOT NULL,
  `name` varchar(125) COLLATE utf8mb4_unicode_ci NOT NULL,
  `departement_id` bigint(20) UNSIGNED NOT NULL,
  `type` enum('restricted','public') COLLATE utf8mb4_unicode_ci NOT NULL DEFAULT 'public',
  `is_attendance` tinyint(1) NOT NULL DEFAULT '1',
  `location_id` bigint(20) UNSIGNED NOT NULL,
  `mode` enum('SCAN','ADD') COLLATE utf8mb4_unicode_ci NOT NULL,
  `createdBy` varchar(125) COLLATE utf8mb4_unicode_ci DEFAULT NULL,
  `updatedBy` varchar(125) COLLATE utf8mb4_unicode_ci DEFAULT NULL,
  `created_at` timestamp NULL DEFAULT NULL,
  `updated_at` timestamp NULL DEFAULT NULL
) ENGINE=InnoDB DEFAULT CHARSET=utf8mb4 COLLATE=utf8mb4_unicode_ci;

--
-- Dumping data for table `attendance_devices`
--

INSERT INTO `attendance_devices` (`id`, `uid`, `name`, `departement_id`, `type`, `is_attendance`, `location_id`, `mode`, `createdBy`, `updatedBy`, `created_at`, `updated_at`) VALUES
(1, '1', 'absensi 1', 1, 'public', 1, 1, 'SCAN', 'Admin', 'Admin', '2021-12-24 14:26:37', '2022-01-10 18:00:46'),
(2, '2', 'absensi 2', 1, 'public', 1, 1, 'SCAN', 'Admin', 'Admin', '2021-12-24 14:44:56', '2022-01-10 18:01:30');

-- --------------------------------------------------------

--
-- Table structure for table `collect_attendances`
--

CREATE TABLE `collect_attendances` (
  `id` bigint(20) UNSIGNED NOT NULL,
  `uid` varchar(125) COLLATE utf8mb4_unicode_ci NOT NULL,
  `user_id` bigint(20) UNSIGNED NOT NULL,
  `jam_masuk` varchar(125) COLLATE utf8mb4_unicode_ci DEFAULT NULL,
  `jam_masuk_photo_path` varchar(2048) COLLATE utf8mb4_unicode_ci DEFAULT NULL,
  `jam_Keluar` varchar(125) COLLATE utf8mb4_unicode_ci DEFAULT NULL,
  `jam_Keluar_photo_path` varchar(2048) COLLATE utf8mb4_unicode_ci DEFAULT NULL,
  `keterangan_detail` varchar(125) COLLATE utf8mb4_unicode_ci NOT NULL COMMENT 'buat keterangan untuk user/admin',
  `keterangan` enum('hadir','terlambat','tidak masuk') COLLATE utf8mb4_unicode_ci DEFAULT NULL,
  `createdBy` varchar(125) COLLATE utf8mb4_unicode_ci DEFAULT NULL,
  `updatedBy` varchar(125) COLLATE utf8mb4_unicode_ci DEFAULT NULL,
  `created_at` timestamp NULL DEFAULT NULL,
  `updated_at` timestamp NULL DEFAULT NULL
) ENGINE=InnoDB DEFAULT CHARSET=utf8mb4 COLLATE=utf8mb4_unicode_ci;

--
-- Dumping data for table `collect_attendances`
--

INSERT INTO `collect_attendances` (`id`, `uid`, `user_id`, `jam_masuk`, `jam_masuk_photo_path`, `jam_Keluar`, `jam_Keluar_photo_path`, `keterangan_detail`, `keterangan`, `createdBy`, `updatedBy`, `created_at`, `updated_at`) VALUES
(1, '1', 39, '2023-02-16 07:00:00', NULL, '2023-02-16 15:00:00', NULL, 'Tidak Masuk', 'tidak masuk', 'System', 'System', '2023-02-16 00:00:00', '2023-02-16 00:00:00'),
(2, '1', 40, '2023-02-16 12:00:00', NULL, '2023-02-16 16:00:00', NULL, 'Tidak Masuk', 'tidak masuk', 'System', 'System', '2023-02-16 05:00:00', '2023-02-16 05:00:00'),
(3, '1', 41, '2023-02-16 07:00:00', NULL, '2023-02-16 17:00:00', NULL, 'Tidak Masuk', 'tidak masuk', 'System', 'System', '2023-02-16 00:00:00', '2023-02-16 00:00:00'),
(4, '1', 39, '2023-02-17 07:00:00', NULL, '2023-02-17 15:00:00', NULL, 'Hadir', 'hadir', NULL, NULL, '2023-02-27 19:53:20', '2023-02-27 19:53:24'),
(5, '1', 40, '2023-02-21 07:00:00', NULL, '2023-02-21 15:00:00', NULL, 'Hadir', 'hadir', NULL, NULL, '2023-02-27 19:53:27', '2023-02-27 19:53:29'),
(6, '1', 41, '2023-02-22 07:00:00', NULL, '2023-02-22 16:00:00', NULL, 'Hadir', 'hadir', NULL, NULL, '2023-02-27 20:03:18', '2023-02-27 20:03:20'),
(7, '1', 41, '2023-02-23 07:00:00', NULL, '2023-02-23 15:00:00', NULL, 'Hadir', 'hadir', NULL, NULL, '2023-02-28 19:25:02', '2023-02-28 19:25:04'),
(9, '1', 40, '2023-03-02 07:00:00', NULL, '2023-03-02 15:00:00', NULL, 'Hadir', 'hadir', NULL, NULL, NULL, NULL);

-- --------------------------------------------------------

--
-- Table structure for table `data_locations`
--

CREATE TABLE `data_locations` (
  `id` bigint(20) UNSIGNED NOT NULL,
  `name` varchar(125) COLLATE utf8mb4_unicode_ci NOT NULL,
  `createdBy` varchar(125) COLLATE utf8mb4_unicode_ci DEFAULT NULL,
  `updatedBy` varchar(125) COLLATE utf8mb4_unicode_ci DEFAULT NULL,
  `created_at` timestamp NULL DEFAULT NULL,
  `updated_at` timestamp NULL DEFAULT NULL
) ENGINE=InnoDB DEFAULT CHARSET=utf8mb4 COLLATE=utf8mb4_unicode_ci;

--
-- Dumping data for table `data_locations`
--

INSERT INTO `data_locations` (`id`, `name`, `createdBy`, `updatedBy`, `created_at`, `updated_at`) VALUES
(1, 'Office', 'Admin', 'Admin', '2021-12-24 14:26:14', '2021-12-24 14:26:14'),
(2, 'Pabrik', 'Admin', 'Admin', '2021-12-24 16:27:01', '2021-12-24 16:27:01'),
(3, 'gudang 3', '@aguskurniawan', '@aguskurniawan', '2022-01-10 10:38:24', '2022-01-10 10:38:47');

-- --------------------------------------------------------

--
-- Table structure for table `doorlock_devices`
--

CREATE TABLE `doorlock_devices` (
  `id` bigint(20) UNSIGNED NOT NULL,
  `uid` varchar(125) COLLATE utf8mb4_unicode_ci NOT NULL,
  `name` varchar(125) COLLATE utf8mb4_unicode_ci NOT NULL,
  `location_id` bigint(20) UNSIGNED NOT NULL,
  `departement_id` bigint(20) UNSIGNED NOT NULL,
  `type` enum('restricted','public') COLLATE utf8mb4_unicode_ci NOT NULL DEFAULT 'public',
  `access_type` enum('in','out') COLLATE utf8mb4_unicode_ci NOT NULL,
  `access_mode` tinyint(1) NOT NULL DEFAULT '0',
  `createdBy` varchar(125) COLLATE utf8mb4_unicode_ci DEFAULT NULL,
  `updatedBy` varchar(125) COLLATE utf8mb4_unicode_ci DEFAULT NULL,
  `intactivemonitoring` tinyint(4) DEFAULT '0',
  `created_at` timestamp NULL DEFAULT NULL,
  `updated_at` timestamp NULL DEFAULT NULL
) ENGINE=InnoDB DEFAULT CHARSET=utf8mb4 COLLATE=utf8mb4_unicode_ci;

--
-- Dumping data for table `doorlock_devices`
--

INSERT INTO `doorlock_devices` (`id`, `uid`, `name`, `location_id`, `departement_id`, `type`, `access_type`, `access_mode`, `createdBy`, `updatedBy`, `intactivemonitoring`, `created_at`, `updated_at`) VALUES
(1, '1', 'Main Gate Prod. in', 2, 1, 'public', 'in', 0, 'Admin', 'CSP', 1, '2021-12-24 16:26:40', '2022-08-11 11:46:01'),
(2, '2', 'Main Gate Prod. out', 2, 1, 'public', 'out', 0, 'Admin', 'CSP', 1, '2021-12-24 16:29:56', '2022-08-11 11:46:25'),
(3, '3', 'Staff Office', 2, 1, 'public', 'in', 0, 'Admin', 'Admin', 0, '2021-12-24 16:30:13', '2021-12-26 15:04:52'),
(4, '4', 'Pintu Gudang 3 in', 2, 2, 'public', 'in', 1, 'Admin', 'Admin', 0, '2021-12-24 16:45:34', '2021-12-26 15:10:18'),
(5, '5', 'Pintu Gudang 3 out', 2, 2, 'public', 'out', 0, 'Admin', 'Admin', 0, '2021-12-26 15:11:21', '2021-12-26 15:11:21'),
(6, '6', 'Pintu Greetag in', 2, 2, 'public', 'in', 0, 'Admin', 'Admin', 0, '2021-12-26 15:46:49', '2021-12-26 15:46:49'),
(7, '7', 'Pintu Greetag out', 2, 2, 'public', 'out', 0, 'Admin', 'Admin', 0, '2021-12-26 15:47:16', '2021-12-26 15:47:16'),
(8, '8', 'Pintu Chiller in', 2, 2, 'public', 'in', 1, 'Admin', 'Admin', 0, '2021-12-26 15:55:38', '2021-12-26 15:55:38'),
(9, '9', 'Pintu Chiller out', 2, 2, 'public', 'out', 0, 'Admin', 'Admin', 0, '2021-12-26 15:56:32', '2021-12-26 15:56:32'),
(10, '10', 'Pintu Inventory in', 2, 2, 'public', 'in', 1, 'Admin', 'Admin', 0, '2021-12-26 16:02:18', '2021-12-26 16:02:18'),
(11, '11', 'Pintu Inventory out', 2, 2, 'public', 'out', 0, 'Admin', 'Admin', 0, '2021-12-26 16:03:08', '2021-12-26 16:03:08');

-- --------------------------------------------------------

--
-- Table structure for table `doorlock_has_employees`
--

CREATE TABLE `doorlock_has_employees` (
  `id` bigint(20) UNSIGNED NOT NULL,
  `memployes_id` bigint(20) UNSIGNED NOT NULL,
  `doorlock_id` bigint(20) UNSIGNED NOT NULL
) ENGINE=InnoDB DEFAULT CHARSET=utf8mb4 COLLATE=utf8mb4_unicode_ci;

--
-- Dumping data for table `doorlock_has_employees`
--

INSERT INTO `doorlock_has_employees` (`id`, `memployes_id`, `doorlock_id`) VALUES
(34, 4, 2),
(37, 4, 1),
(49, 6, 1),
(50, 6, 2),
(51, 6, 3),
(52, 6, 4),
(53, 6, 5),
(54, 6, 6),
(55, 6, 7),
(56, 6, 8),
(57, 6, 9),
(58, 6, 10),
(59, 6, 11),
(60, 10, 1),
(61, 10, 2),
(62, 10, 3),
(63, 10, 4),
(64, 10, 5),
(65, 10, 6),
(66, 10, 7),
(67, 10, 8),
(68, 10, 9),
(69, 10, 10),
(70, 10, 11),
(84, 7, 1),
(85, 7, 2),
(86, 7, 3),
(87, 7, 4),
(88, 7, 5),
(89, 7, 6),
(90, 7, 7),
(91, 7, 8),
(92, 7, 9),
(93, 7, 10),
(94, 7, 11),
(95, 11, 1),
(96, 11, 2),
(97, 11, 3),
(98, 11, 4),
(99, 11, 5),
(100, 11, 6),
(101, 11, 7),
(102, 11, 8),
(103, 11, 9),
(104, 11, 10),
(105, 11, 11),
(108, 4, 3),
(109, 4, 4),
(110, 4, 5),
(111, 4, 6),
(112, 4, 7),
(113, 4, 8),
(114, 4, 9),
(115, 4, 10),
(116, 4, 11),
(148, 28, 3),
(149, 29, 1),
(150, 29, 2),
(151, 29, 8),
(152, 29, 9),
(163, 31, 4),
(164, 31, 5),
(165, 31, 6),
(166, 31, 7),
(167, 32, 1),
(168, 32, 2),
(169, 32, 8),
(170, 32, 9),
(173, 33, 1),
(174, 33, 2),
(175, 33, 3),
(176, 33, 4),
(177, 33, 5),
(178, 33, 6),
(179, 33, 7),
(180, 33, 8),
(181, 33, 9),
(182, 33, 10),
(183, 33, 11),
(184, 34, 3),
(185, 35, 1),
(186, 35, 2),
(189, 36, 1),
(190, 36, 2),
(191, 37, 1),
(192, 37, 2),
(193, 38, 4),
(194, 38, 5),
(195, 38, 6),
(196, 38, 7),
(199, 39, 1),
(200, 39, 2),
(203, 40, 3),
(204, 41, 1),
(205, 41, 2),
(206, 41, 8),
(207, 41, 9),
(208, 41, 10),
(209, 41, 11),
(210, 42, 1),
(211, 42, 2),
(212, 42, 6),
(213, 42, 7),
(214, 42, 8),
(215, 42, 9),
(216, 42, 10),
(217, 42, 11),
(218, 43, 1),
(219, 43, 2),
(220, 43, 8),
(221, 43, 9),
(224, 44, 1),
(225, 44, 2),
(226, 44, 8),
(227, 44, 9),
(230, 45, 1),
(231, 45, 2),
(234, 46, 1),
(235, 46, 2),
(236, 46, 4),
(237, 46, 5),
(238, 46, 6),
(239, 46, 7),
(240, 46, 8),
(241, 46, 9),
(244, 48, 1),
(245, 48, 2),
(246, 49, 1),
(247, 49, 2),
(248, 50, 1),
(249, 50, 2),
(250, 51, 1),
(251, 51, 2),
(252, 52, 1),
(253, 52, 2),
(256, 54, 1),
(257, 54, 2),
(258, 55, 1),
(259, 55, 2),
(260, 56, 1),
(261, 56, 2),
(262, 57, 1),
(263, 57, 2),
(264, 58, 1),
(265, 58, 2),
(268, 60, 1),
(269, 60, 2),
(270, 61, 1),
(271, 61, 2),
(272, 62, 1),
(273, 62, 2),
(274, 63, 1),
(275, 63, 2),
(276, 64, 1),
(277, 64, 2),
(278, 65, 1),
(279, 65, 2),
(284, 68, 1),
(285, 68, 2),
(286, 69, 1),
(287, 69, 2),
(288, 70, 1),
(289, 70, 2),
(290, 71, 1),
(291, 71, 2),
(292, 72, 1),
(293, 72, 2),
(294, 73, 1),
(295, 73, 2),
(296, 74, 1),
(297, 74, 2),
(298, 75, 1),
(299, 75, 2),
(300, 76, 1),
(301, 76, 2),
(302, 77, 1),
(303, 77, 2),
(304, 71, 4),
(305, 71, 5),
(306, 72, 4),
(307, 72, 5),
(308, 78, 1),
(309, 78, 2),
(310, 78, 4),
(311, 78, 5),
(312, 78, 6),
(313, 78, 7),
(314, 78, 8),
(315, 78, 9),
(316, 36, 4),
(317, 36, 5),
(318, 36, 6),
(319, 36, 7),
(320, 79, 1),
(321, 79, 2),
(322, 79, 8),
(323, 79, 9),
(324, 79, 10),
(325, 79, 11),
(326, 65, 8),
(327, 65, 9),
(330, 80, 1),
(331, 80, 2),
(332, 80, 4),
(333, 80, 5),
(334, 80, 6),
(335, 80, 7),
(336, 80, 8),
(337, 80, 9),
(338, 81, 1),
(339, 81, 2),
(340, 81, 4),
(341, 81, 5),
(342, 81, 6),
(343, 81, 7),
(344, 81, 8),
(345, 81, 9),
(346, 56, 4),
(347, 56, 5),
(348, 56, 6),
(349, 56, 7),
(350, 56, 8),
(351, 56, 9),
(352, 54, 4),
(353, 54, 5),
(354, 54, 6),
(355, 54, 7),
(356, 54, 8),
(357, 54, 9),
(358, 54, 10),
(359, 54, 11),
(360, 37, 6),
(361, 37, 7),
(362, 37, 4),
(363, 37, 5),
(364, 82, 1),
(365, 82, 2),
(366, 38, 1),
(367, 38, 2),
(368, 38, 8),
(369, 38, 9),
(370, 83, 1),
(371, 83, 2),
(372, 84, 1),
(373, 84, 2),
(374, 85, 1),
(375, 85, 2),
(376, 86, 1),
(377, 86, 2),
(378, 87, 1),
(379, 87, 2),
(380, 88, 1),
(381, 88, 2),
(382, 89, 1),
(383, 89, 2),
(384, 90, 1),
(385, 90, 2),
(386, 90, 6),
(387, 90, 7),
(388, 90, 10),
(389, 90, 11),
(390, 91, 1),
(391, 91, 2),
(394, 93, 1),
(395, 93, 2),
(396, 94, 1),
(397, 94, 2),
(398, 95, 1),
(399, 95, 2),
(400, 96, 1),
(401, 96, 2),
(402, 97, 1),
(403, 97, 2),
(404, 98, 1),
(405, 98, 2),
(406, 60, 6),
(407, 60, 7),
(408, 60, 8),
(409, 60, 9),
(410, 99, 1),
(411, 99, 2),
(412, 99, 4),
(413, 99, 5),
(414, 99, 6),
(415, 99, 7),
(416, 100, 1),
(417, 100, 2),
(418, 101, 1),
(419, 101, 2),
(420, 102, 1),
(421, 102, 2),
(424, 73, 8),
(425, 73, 9),
(428, 39, 8),
(429, 39, 9),
(430, 39, 10),
(431, 39, 11),
(432, 35, 8),
(433, 35, 9),
(436, 102, 4),
(437, 102, 5),
(438, 102, 6),
(439, 102, 7),
(440, 102, 8),
(441, 102, 9),
(442, 96, 4),
(443, 96, 5),
(444, 96, 6),
(445, 96, 7),
(446, 96, 8),
(447, 96, 9),
(448, 97, 8),
(449, 97, 9),
(456, 104, 1),
(457, 104, 2),
(466, 88, 8),
(467, 88, 9),
(468, 74, 6),
(469, 74, 7),
(470, 74, 8),
(471, 74, 9),
(486, 105, 1),
(487, 105, 2),
(488, 105, 3),
(489, 105, 4),
(490, 105, 5),
(491, 105, 6),
(492, 105, 7),
(493, 105, 8),
(494, 105, 9),
(495, 105, 10),
(496, 105, 11),
(497, 106, 1),
(498, 106, 2),
(499, 106, 3),
(500, 106, 4),
(501, 106, 5),
(504, 90, 8),
(505, 90, 9),
(508, 107, 1),
(509, 107, 2),
(510, 111, 1),
(511, 111, 2),
(512, 112, 1),
(513, 112, 2),
(514, 114, 1),
(515, 114, 2),
(516, 115, 1),
(517, 115, 2),
(518, 116, 1),
(519, 116, 2),
(520, 117, 1),
(521, 117, 2),
(522, 31, 1),
(523, 31, 2),
(530, 122, 1),
(531, 122, 2),
(532, 30, 1),
(533, 30, 2),
(534, 30, 6),
(535, 30, 7),
(536, 30, 8),
(537, 30, 9),
(538, 30, 10),
(539, 30, 11);

-- --------------------------------------------------------

--
-- Table structure for table `doorlock_has_priset`
--

CREATE TABLE `doorlock_has_priset` (
  `id` bigint(20) UNSIGNED NOT NULL,
  `priset_id` bigint(20) UNSIGNED NOT NULL,
  `doorlock_id` bigint(20) UNSIGNED NOT NULL
) ENGINE=InnoDB DEFAULT CHARSET=utf8mb4 COLLATE=utf8mb4_unicode_ci;

--
-- Dumping data for table `doorlock_has_priset`
--

INSERT INTO `doorlock_has_priset` (`id`, `priset_id`, `doorlock_id`) VALUES
(5, 5, 4),
(6, 6, 4),
(7, 2, 8),
(8, 7, 8),
(9, 4, 10),
(10, 8, 10);

-- --------------------------------------------------------

--
-- Table structure for table `doorlock_reports`
--

CREATE TABLE `doorlock_reports` (
  `id` bigint(20) UNSIGNED NOT NULL,
  `uid` varchar(125) COLLATE utf8mb4_unicode_ci NOT NULL,
  `user_id` bigint(20) UNSIGNED NOT NULL,
  `keterangan` varchar(125) COLLATE utf8mb4_unicode_ci NOT NULL,
  `doorlock_photo_path` varchar(2048) COLLATE utf8mb4_unicode_ci DEFAULT NULL,
  `remark_log` varchar(125) COLLATE utf8mb4_unicode_ci DEFAULT NULL,
  `count_access` int(11) NOT NULL DEFAULT '0',
  `createdBy` varchar(125) COLLATE utf8mb4_unicode_ci DEFAULT NULL,
  `updatedBy` varchar(125) COLLATE utf8mb4_unicode_ci DEFAULT NULL,
  `created_at` timestamp NULL DEFAULT NULL,
  `updated_at` timestamp NULL DEFAULT NULL
) ENGINE=InnoDB DEFAULT CHARSET=utf8mb4 COLLATE=utf8mb4_unicode_ci;

--
-- Dumping data for table `doorlock_reports`
--

INSERT INTO `doorlock_reports` (`id`, `uid`, `user_id`, `keterangan`, `doorlock_photo_path`, `remark_log`, `count_access`, `createdBy`, `updatedBy`, `created_at`, `updated_at`) VALUES
(405, '1', 4, 'Access Granted', NULL, '-', 0, 'Tazaka Room : 1', 'Tazaka Room : 1', '2022-01-10 17:37:30', '2022-01-10 17:37:30'),
(406, '1', 4, 'Access Granted', NULL, '-', 0, 'Tazaka Room : 1', 'Tazaka Room : 1', '2022-01-10 17:38:06', '2022-01-10 17:38:06'),
(407, '1', 4, 'Access Granted', NULL, '-', 0, 'Tazaka Room : 1', 'Tazaka Room : 1', '2022-01-10 17:40:17', '2022-01-10 17:40:17'),
(408, '1', 4, 'Access Granted', NULL, '-', 0, 'Tazaka Room : 1', 'Tazaka Room : 1', '2022-01-10 17:41:17', '2022-01-10 17:41:17'),
(409, '1', 4, 'Access Granted', 'storage/doorlock/doorlock_access_409_10-01-2022.jpg', '-', 0, 'Tazaka Room : 1', 'Tazaka Room : 1', '2022-01-10 17:42:34', '2022-01-10 17:42:37'),
(423, '4', 6, 'Access Granted', NULL, 'Mengambil barang gudang 3', 1, 'Tazaka Room : 4', 'Tazaka Room : 4', '2022-01-11 11:56:56', '2022-01-11 11:57:13'),
(424, '10', 6, 'Access Granted', NULL, 'Inventory tools', 0, 'Tazaka Room : 10', 'Tazaka Room : 10', '2022-01-11 11:57:48', '2022-01-11 11:58:01'),
(425, '11', 6, 'Access Granted', NULL, '-', 1, 'Tazaka Room : 11', 'Tazaka Room : 11', '2022-01-11 11:58:30', '2022-01-11 11:58:35'),
(426, '6', 6, 'Access Granted', NULL, '-', 0, 'Tazaka Room : 6', 'Tazaka Room : 6', '2022-01-11 12:00:26', '2022-01-11 12:00:26'),
(427, '6', 6, 'Access Granted', NULL, '-', 0, 'Tazaka Room : 6', 'Tazaka Room : 6', '2022-01-11 12:00:39', '2022-01-11 12:00:39'),
(429, '6', 6, 'Access Granted', NULL, '-', 0, 'Tazaka Room : 6', 'Tazaka Room : 6', '2022-01-11 12:02:21', '2022-01-11 12:02:21'),
(430, '6', 6, 'Access Granted', NULL, '-', 0, 'Tazaka Room : 6', 'Tazaka Room : 6', '2022-01-11 12:02:48', '2022-01-11 12:02:48'),
(431, '5', 6, 'Access Granted', NULL, '-', 0, 'Tazaka Room : 5', 'Tazaka Room : 5', '2022-01-11 12:04:06', '2022-01-11 12:04:06'),
(432, '4', 6, 'Access Granted', NULL, 'Mengambil barang gudang 3', 0, 'Tazaka Room : 4', 'Tazaka Room : 4', '2022-01-11 12:04:31', '2022-01-11 12:04:47'),
(451, '8', 10, 'Access Granted', NULL, 'Maintenance Mesin', 0, 'Tazaka Room : 8', 'Tazaka Room : 8', '2022-01-11 16:07:02', '2022-01-11 16:07:11'),
(454, '10', 7, 'Access Granted', NULL, 'Inventory tools', 0, 'Tazaka Room : 10', 'Tazaka Room : 10', '2022-01-11 16:10:02', '2022-01-11 16:10:10'),
(455, '10', 7, 'Access Granted', NULL, 'Inventory tools', 0, 'Tazaka Room : 10', 'Tazaka Room : 10', '2022-01-11 16:10:22', '2022-01-11 16:10:32'),
(456, '11', 7, 'Access Granted', NULL, '-', 0, 'Tazaka Room : 11', 'Tazaka Room : 11', '2022-01-11 16:10:44', '2022-01-11 16:10:44'),
(459, '10', 10, 'Access Granted', NULL, 'Inventory tools', 0, 'Tazaka Room : 10', 'Tazaka Room : 10', '2022-01-11 18:37:05', '2022-01-11 18:37:16'),
(474, '10', 7, 'Access Granted', NULL, 'Inventory tools', 0, 'Tazaka Room : 10', 'Tazaka Room : 10', '2022-01-12 07:45:07', '2022-01-12 07:45:15'),
(476, '10', 7, 'Access Granted', NULL, 'Inventory tools', 0, 'Tazaka Room : 10', 'Tazaka Room : 10', '2022-01-12 08:14:20', '2022-01-12 08:14:29'),
(477, '10', 7, 'Access Granted', NULL, 'Inventory tools', 0, 'Tazaka Room : 10', 'Tazaka Room : 10', '2022-01-12 08:21:05', '2022-01-12 08:21:14'),
(479, '10', 7, 'Access Granted', NULL, 'Inventory tools', 0, 'Tazaka Room : 10', 'Tazaka Room : 10', '2022-01-12 08:42:32', '2022-01-12 08:42:46'),
(483, '8', 7, 'Access Granted', NULL, 'Maintenance Mesin', 0, 'Tazaka Room : 8', 'Tazaka Room : 8', '2022-01-12 10:16:08', '2022-01-12 10:16:20'),
(484, '10', 7, 'Access Granted', NULL, 'Inventory tools', 1, 'Tazaka Room : 10', 'Tazaka Room : 10', '2022-01-12 10:29:03', '2022-01-12 10:29:17'),
(487, '10', 7, 'Access Granted', NULL, 'Inventory tools', 0, 'Tazaka Room : 10', 'Tazaka Room : 10', '2022-01-12 11:15:24', '2022-01-12 11:15:35'),
(499, '10', 10, 'Access Granted', NULL, 'Inventory tools', 0, 'Tazaka Room : 10', 'Tazaka Room : 10', '2022-01-12 16:09:52', '2022-01-12 16:10:03'),
(500, '10', 7, 'Access Granted', NULL, 'Inventory tools', 0, 'Tazaka Room : 10', 'Tazaka Room : 10', '2022-01-12 16:18:16', '2022-01-12 16:18:26'),
(501, '8', 7, 'Access Granted', NULL, 'Maintenance Mesin', 0, 'Tazaka Room : 8', 'Tazaka Room : 8', '2022-01-12 16:58:26', '2022-01-12 16:58:38'),
(502, '10', 10, 'Access Granted', NULL, 'Inventory tools', 0, 'Tazaka Room : 10', 'Tazaka Room : 10', '2022-01-12 17:06:26', '2022-01-12 17:06:37'),
(503, '10', 7, 'Access Granted', NULL, 'Inventory tools', 0, 'Tazaka Room : 10', 'Tazaka Room : 10', '2022-01-12 17:19:51', '2022-01-12 17:20:01'),
(507, '10', 7, 'Access Granted', NULL, 'Inventory tools', 0, 'Tazaka Room : 10', 'Tazaka Room : 10', '2022-01-13 13:15:54', '2022-01-13 13:16:11'),
(514, '10', 10, 'Access Granted', NULL, 'Inventory tools', 0, 'Tazaka Room : 10', 'Tazaka Room : 10', '2022-01-13 13:19:53', '2022-01-13 13:20:02'),
(517, '10', 7, 'Access Granted', NULL, 'Mengambil Bor', 0, 'Tazaka Room : 10', 'Tazaka Room : 10', '2022-01-13 13:29:15', '2022-01-13 13:29:28'),
(518, '10', 7, 'Access Granted', NULL, 'Inventory tools', 0, 'Tazaka Room : 10', 'Tazaka Room : 10', '2022-01-13 13:33:10', '2022-01-13 13:33:30'),
(520, '10', 10, 'Access Granted', NULL, 'Inventory tools', 0, 'Tazaka Room : 10', 'Tazaka Room : 10', '2022-01-13 14:04:31', '2022-01-13 14:04:41'),
(521, '10', 7, 'Access Granted', NULL, 'Inventory tools', 0, 'Tazaka Room : 10', 'Tazaka Room : 10', '2022-01-13 14:44:09', '2022-01-13 14:44:18'),
(524, '10', 10, 'Access Granted', NULL, 'Inventory tools', 0, 'Tazaka Room : 10', 'Tazaka Room : 10', '2022-01-13 15:12:05', '2022-01-13 15:12:14'),
(527, '8', 10, 'Access Granted', NULL, 'Maintenance Mesin', 1, 'Tazaka Room : 8', 'Tazaka Room : 8', '2022-01-13 16:47:55', '2022-01-13 16:48:10'),
(542, '10', 10, 'Access Granted', NULL, 'Inventory tools', 0, 'Tazaka Room : 10', 'Tazaka Room : 10', '2022-01-14 11:06:37', '2022-01-14 11:06:52'),
(543, '10', 10, 'Access Granted', NULL, 'Mengambil Bor', 0, 'Tazaka Room : 10', 'Tazaka Room : 10', '2022-01-14 11:07:07', '2022-01-14 11:07:23'),
(545, '10', 7, 'Access Granted', NULL, 'Inventory tools', 0, 'Tazaka Room : 10', 'Tazaka Room : 10', '2022-01-14 13:20:12', '2022-01-14 13:22:40'),
(552, '10', 10, 'Access Granted', NULL, 'Inventory tools', 0, 'Tazaka Room : 10', 'Tazaka Room : 10', '2022-01-15 10:09:34', '2022-01-15 10:09:50'),
(553, '10', 10, 'Access Granted', NULL, 'Inventory tools', 0, 'Tazaka Room : 10', 'Tazaka Room : 10', '2022-01-15 10:13:03', '2022-01-15 10:13:15'),
(554, '10', 7, 'Access Granted', NULL, 'Inventory tools', 0, 'Tazaka Room : 10', 'Tazaka Room : 10', '2022-01-15 10:22:27', '2022-01-15 10:22:34'),
(555, '10', 10, 'Access Granted', NULL, 'Mengambil Bor', 0, 'Tazaka Room : 10', 'Tazaka Room : 10', '2022-01-15 11:00:23', '2022-01-15 11:00:35'),
(557, '10', 7, 'Access Granted', NULL, 'Inventory tools', 0, 'Tazaka Room : 10', 'Tazaka Room : 10', '2022-01-15 13:18:27', '2022-01-15 13:18:35'),
(558, '8', 10, 'Access Granted', NULL, 'Maintenance Mesin', 0, 'Tazaka Room : 8', 'Tazaka Room : 8', '2022-01-16 08:56:24', '2022-01-16 08:56:36'),
(559, '10', 10, 'Access Granted', NULL, 'Inventory tools', 0, 'Tazaka Room : 10', 'Tazaka Room : 10', '2022-01-16 09:55:32', '2022-01-16 09:55:41'),
(560, '8', 10, 'Access Granted', NULL, 'Maintenance Mesin', 0, 'Tazaka Room : 8', 'Tazaka Room : 8', '2022-01-17 06:36:35', '2022-01-17 06:36:43'),
(562, '8', 10, 'Access Granted', NULL, 'Maintenance Mesin', 0, 'Tazaka Room : 8', 'Tazaka Room : 8', '2022-01-17 07:29:57', '2022-01-17 07:30:12'),
(564, '4', 6, 'Access Granted', NULL, 'Stock opname', 0, 'Tazaka Room : 4', 'Tazaka Room : 4', '2022-01-17 10:10:46', '2022-01-17 10:10:58'),
(565, '5', 6, 'Access Granted', NULL, '-', 1, 'Tazaka Room : 5', 'Tazaka Room : 5', '2022-01-17 10:11:08', '2022-01-17 10:11:14'),
(567, '10', 10, 'Access Granted', NULL, 'Inventory tools', 0, 'Tazaka Room : 10', 'Tazaka Room : 10', '2022-01-17 12:08:45', '2022-01-17 12:08:53'),
(577, '4', 6, 'Access Granted', NULL, '-', 0, 'Tazaka Room : 4', 'Tazaka Room : 4', '2022-01-17 14:29:19', '2022-01-17 14:29:19'),
(578, '5', 6, 'Access Granted', NULL, '-', 1, 'Tazaka Room : 5', 'Tazaka Room : 5', '2022-01-17 14:29:38', '2022-01-17 14:29:43'),
(579, '10', 6, 'Access Granted', NULL, '-', 0, 'Tazaka Room : 10', 'Tazaka Room : 10', '2022-01-17 14:30:18', '2022-01-17 14:30:18'),
(580, '10', 6, 'Access Granted', NULL, 'Inventory tools', 1, 'Tazaka Room : 10', 'Tazaka Room : 10', '2022-01-17 14:30:24', '2022-01-17 14:30:36'),
(581, '10', 6, 'Access Granted', NULL, 'Inventory tools', 0, 'Tazaka Room : 10', 'Tazaka Room : 10', '2022-01-17 14:30:56', '2022-01-17 14:31:06'),
(583, '8', 6, 'Access Granted', NULL, 'Maintenance Mesin', 0, 'Tazaka Room : 8', 'Tazaka Room : 8', '2022-01-17 14:32:12', '2022-01-17 14:32:26'),
(584, '9', 6, 'Access Granted', NULL, '-', 0, 'Tazaka Room : 9', 'Tazaka Room : 9', '2022-01-17 14:32:53', '2022-01-17 14:32:53'),
(590, '10', 10, 'Access Granted', NULL, 'Inventory tools', 0, 'Tazaka Room : 10', 'Tazaka Room : 10', '2022-01-18 07:21:46', '2022-01-18 07:21:58'),
(608, '10', 10, 'Access Granted', NULL, 'Inventory tools', 0, 'Tazaka Room : 10', 'Tazaka Room : 10', '2022-01-19 08:39:22', '2022-01-19 08:39:38'),
(609, '10', 10, 'Access Granted', NULL, 'Inventory tools', 0, 'Tazaka Room : 10', 'Tazaka Room : 10', '2022-01-19 09:33:43', '2022-01-19 09:33:53'),
(615, '10', 10, 'Access Granted', NULL, 'Inventory tools', 0, 'Tazaka Room : 10', 'Tazaka Room : 10', '2022-01-19 11:08:40', '2022-01-19 11:08:52'),
(621, '10', 7, 'Access Granted', NULL, 'Inventory tools', 0, 'Tazaka Room : 10', 'Tazaka Room : 10', '2022-01-19 16:46:15', '2022-01-19 16:46:33'),
(622, '10', 10, 'Access Granted', NULL, 'Inventory tools', 0, 'Tazaka Room : 10', 'Tazaka Room : 10', '2022-01-19 17:06:14', '2022-01-19 17:06:24'),
(623, '10', 7, 'Access Granted', NULL, 'Inventory tools', 0, 'Tazaka Room : 10', 'Tazaka Room : 10', '2022-01-19 17:25:22', '2022-01-19 17:25:31'),
(633, '10', 10, 'Access Granted', NULL, 'Mengambil Bor', 0, 'Tazaka Room : 10', 'Tazaka Room : 10', '2022-01-20 08:16:00', '2022-01-20 08:16:09'),
(635, '10', 7, 'Access Granted', NULL, 'Inventory tools', 0, 'Tazaka Room : 10', 'Tazaka Room : 10', '2022-01-20 09:16:24', '2022-01-20 09:16:34'),
(643, '8', 7, 'Access Granted', NULL, 'Maintenance Chiller', 1, 'Tazaka Room : 8', 'Tazaka Room : 8', '2022-01-20 11:46:49', '2022-01-20 11:47:08'),
(645, '10', 7, 'Access Granted', NULL, 'Inventory tools', 0, 'Tazaka Room : 10', 'Tazaka Room : 10', '2022-01-20 13:12:53', '2022-01-20 13:13:01'),
(648, '8', 10, 'Access Granted', NULL, 'Maintenance Mesin', 0, 'Tazaka Room : 8', 'Tazaka Room : 8', '2022-01-20 13:29:33', '2022-01-20 13:29:41'),
(649, '10', 7, 'Access Granted', NULL, 'Inventory tools', 0, 'Tazaka Room : 10', 'Tazaka Room : 10', '2022-01-20 13:41:14', '2022-01-20 13:41:23'),
(650, '10', 10, 'Access Granted', NULL, 'Inventory tools', 0, 'Tazaka Room : 10', 'Tazaka Room : 10', '2022-01-20 13:57:51', '2022-01-20 13:58:06'),
(652, '10', 7, 'Access Granted', NULL, 'Inventory tools', 0, 'Tazaka Room : 10', 'Tazaka Room : 10', '2022-01-20 14:13:02', '2022-01-20 14:13:10'),
(654, '8', 10, 'Access Granted', NULL, 'Maintenance Mesin', 0, 'Tazaka Room : 8', 'Tazaka Room : 8', '2022-01-20 14:33:30', '2022-01-20 14:33:40'),
(655, '10', 10, 'Access Granted', NULL, 'Inventory tools', 0, 'Tazaka Room : 10', 'Tazaka Room : 10', '2022-01-20 14:37:08', '2022-01-20 14:37:18'),
(659, '10', 10, 'Access Granted', NULL, 'Inventory tools', 0, 'Tazaka Room : 10', 'Tazaka Room : 10', '2022-01-20 14:54:11', '2022-01-20 14:54:23'),
(663, '10', 7, 'Access Granted', NULL, 'Inventory tools', 0, 'Tazaka Room : 10', 'Tazaka Room : 10', '2022-01-20 16:22:19', '2022-01-20 16:22:27'),
(665, '10', 7, 'Access Granted', NULL, 'Inventory tools', 0, 'Tazaka Room : 10', 'Tazaka Room : 10', '2022-01-20 16:38:08', '2022-01-20 16:38:23'),
(670, '10', 10, 'Access Granted', NULL, 'Inventory tools', 0, 'Tazaka Room : 10', 'Tazaka Room : 10', '2022-01-20 17:30:45', '2022-01-20 17:30:56'),
(671, '10', 10, 'Access Granted', NULL, 'Inventory tools', 0, 'Tazaka Room : 10', 'Tazaka Room : 10', '2022-01-20 18:37:00', '2022-01-20 18:37:09'),
(674, '10', 7, 'Access Granted', NULL, 'Inventory tools', 0, 'Tazaka Room : 10', 'Tazaka Room : 10', '2022-01-21 08:13:48', '2022-01-21 08:13:57'),
(675, '10', 10, 'Access Granted', NULL, 'Inventory tools', 0, 'Tazaka Room : 10', 'Tazaka Room : 10', '2022-01-21 08:27:20', '2022-01-21 08:27:31'),
(679, '10', 10, 'Access Granted', NULL, 'Mengambil Bor', 0, 'Tazaka Room : 10', 'Tazaka Room : 10', '2022-01-21 10:26:55', '2022-01-21 10:27:04'),
(683, '10', 10, 'Access Granted', NULL, 'Inventory tools', 1, 'Tazaka Room : 10', 'Tazaka Room : 10', '2022-01-21 11:07:40', '2022-01-21 11:07:56'),
(687, '10', 7, 'Access Granted', NULL, 'Inventory tools', 0, 'Tazaka Room : 10', 'Tazaka Room : 10', '2022-01-21 13:13:53', '2022-01-21 13:14:03'),
(688, '10', 10, 'Access Granted', NULL, '-', 0, 'Tazaka Room : 10', 'Tazaka Room : 10', '2022-01-21 13:19:25', '2022-01-21 13:19:25'),
(689, '10', 7, 'Access Granted', NULL, 'Inventory tools', 1, 'Tazaka Room : 10', 'Tazaka Room : 10', '2022-01-21 14:41:35', '2022-01-21 14:41:55'),
(690, '10', 10, 'Access Granted', NULL, 'Inventory tools', 0, 'Tazaka Room : 10', 'Tazaka Room : 10', '2022-01-21 14:46:42', '2022-01-21 14:46:51'),
(691, '10', 10, 'Access Granted', NULL, 'Inventory tools', 0, 'Tazaka Room : 10', 'Tazaka Room : 10', '2022-01-21 15:01:20', '2022-01-21 15:01:32'),
(694, '3', 7, 'Access Granted', NULL, '-', 1, 'Tazaka Room : 3', 'Tazaka Room : 3', '2022-01-21 15:55:47', '2022-01-21 15:55:52'),
(695, '10', 10, 'Access Granted', NULL, 'Inventory tools', 0, 'Tazaka Room : 10', 'Tazaka Room : 10', '2022-01-21 16:03:39', '2022-01-21 16:03:47'),
(696, '10', 10, 'Access Granted', NULL, 'Inventory tools', 0, 'Tazaka Room : 10', 'Tazaka Room : 10', '2022-01-21 16:17:07', '2022-01-21 16:17:22'),
(697, '10', 10, 'Access Granted', NULL, 'Inventory tools', 0, 'Tazaka Room : 10', 'Tazaka Room : 10', '2022-01-21 16:55:28', '2022-01-21 16:55:36'),
(698, '10', 10, 'Access Granted', NULL, 'Inventory tools', 0, 'Tazaka Room : 10', 'Tazaka Room : 10', '2022-01-21 17:10:09', '2022-01-21 17:10:18'),
(706, '10', 10, 'Access Granted', NULL, 'Mengambil Bor', 0, 'Tazaka Room : 10', 'Tazaka Room : 10', '2022-01-22 10:16:51', '2022-01-22 10:17:04'),
(707, '10', 10, 'Access Granted', NULL, 'Inventory tools', 0, 'Tazaka Room : 10', 'Tazaka Room : 10', '2022-01-22 11:43:58', '2022-01-22 11:44:10'),
(710, '8', 10, 'Access Granted', NULL, 'Maintenance Mesin', 0, 'Tazaka Room : 8', 'Tazaka Room : 8', '2022-01-23 17:48:22', '2022-01-23 17:48:31'),
(711, '10', 10, 'Access Granted', NULL, 'Inventory tools', 0, 'Tazaka Room : 10', 'Tazaka Room : 10', '2022-01-23 18:08:24', '2022-01-23 18:08:35'),
(712, '8', 10, 'Access Granted', NULL, 'Maintenance Mesin', 1, 'Tazaka Room : 8', 'Tazaka Room : 8', '2022-01-24 06:10:24', '2022-01-24 06:10:42'),
(717, '10', 7, 'Access Granted', NULL, 'Inventory tools', 0, 'Tazaka Room : 10', 'Tazaka Room : 10', '2022-01-24 07:36:14', '2022-01-24 07:36:23'),
(720, '8', 10, 'Access Granted', NULL, 'Maintenance Mesin', 0, 'Tazaka Room : 8', 'Tazaka Room : 8', '2022-01-24 10:40:44', '2022-01-24 10:40:56'),
(721, '6', 6, 'Access Granted', NULL, '-', 0, 'Tazaka Room : 6', 'Tazaka Room : 6', '2022-01-24 13:12:35', '2022-01-24 13:12:35'),
(722, '7', 6, 'Access Granted', NULL, '-', 1, 'Tazaka Room : 7', 'Tazaka Room : 7', '2022-01-24 13:13:08', '2022-01-24 13:13:13'),
(723, '7', 6, 'Access Granted', NULL, '-', 1, 'Tazaka Room : 7', 'Tazaka Room : 7', '2022-01-24 13:13:23', '2022-01-24 13:13:28'),
(724, '10', 6, 'Access Granted', NULL, '-', 0, 'Tazaka Room : 10', 'Tazaka Room : 10', '2022-01-24 13:15:06', '2022-01-24 13:15:06'),
(725, '10', 6, 'Access Granted', NULL, 'Inventory tools', 0, 'Tazaka Room : 10', 'Tazaka Room : 10', '2022-01-24 13:15:12', '2022-01-24 13:15:26'),
(726, '11', 6, 'Access Granted', NULL, '-', 0, 'Tazaka Room : 11', 'Tazaka Room : 11', '2022-01-24 13:17:55', '2022-01-24 13:17:55'),
(727, '10', 7, 'Access Granted', NULL, 'Inventory tools', 0, 'Tazaka Room : 10', 'Tazaka Room : 10', '2022-01-24 14:30:42', '2022-01-24 14:30:59'),
(728, '5', 7, 'Access Granted', NULL, '-', 0, 'Tazaka Room : 5', 'Tazaka Room : 5', '2022-01-24 14:32:34', '2022-01-24 14:32:34'),
(729, '4', 7, 'Access Granted', NULL, 'Mengambil barang gudang 3', 0, 'Tazaka Room : 4', 'Tazaka Room : 4', '2022-01-24 14:33:58', '2022-01-24 14:34:09'),
(735, '10', 7, 'Access Granted', NULL, 'Inventory tools', 0, 'Tazaka Room : 10', 'Tazaka Room : 10', '2022-01-24 16:49:08', '2022-01-24 16:49:18'),
(741, '10', 7, 'Access Granted', NULL, 'Inventory tools', 0, 'Tazaka Room : 10', 'Tazaka Room : 10', '2022-01-25 08:21:38', '2022-01-25 08:21:48'),
(742, '10', 10, 'Access Granted', NULL, 'Inventory tools', 0, 'Tazaka Room : 10', 'Tazaka Room : 10', '2022-01-25 09:18:02', '2022-01-25 09:18:13'),
(743, '7', 7, 'Access Granted', NULL, '-', 1, 'Tazaka Room : 7', 'Tazaka Room : 7', '2022-01-25 09:28:51', '2022-01-25 09:28:56'),
(744, '7', 7, 'Access Granted', NULL, '-', 0, 'Tazaka Room : 7', 'Tazaka Room : 7', '2022-01-25 09:29:02', '2022-01-25 09:29:02'),
(750, '8', 7, 'Access Granted', NULL, 'Maintenance Mesin', 0, 'Tazaka Room : 8', 'Tazaka Room : 8', '2022-01-27 07:51:53', '2022-01-27 07:52:04'),
(751, '8', 7, 'Access Granted', NULL, '-', 0, 'Tazaka Room : 8', 'Tazaka Room : 8', '2022-01-27 08:12:10', '2022-01-27 08:12:10'),
(752, '8', 7, 'Access Granted', NULL, 'Maintenance Mesin', 1, 'Tazaka Room : 8', 'Tazaka Room : 8', '2022-01-27 08:12:17', '2022-01-27 08:12:34'),
(759, '10', 7, 'Access Granted', NULL, 'Inventory tools', 0, 'Tazaka Room : 10', 'Tazaka Room : 10', '2022-01-28 08:32:48', '2022-01-28 08:32:57'),
(760, '10', 7, 'Access Granted', NULL, 'Inventory tools', 0, 'Tazaka Room : 10', 'Tazaka Room : 10', '2022-01-28 10:13:52', '2022-01-28 10:14:01'),
(766, '2', 7, 'Access Granted', NULL, '-', 0, 'Tazaka Room : 2', 'Tazaka Room : 2', '2022-01-28 13:14:24', '2022-01-28 13:14:24'),
(768, '10', 10, 'Access Granted', NULL, 'Inventory tools', 0, 'Tazaka Room : 10', 'Tazaka Room : 10', '2022-01-28 14:12:46', '2022-01-28 14:12:58'),
(769, '10', 10, 'Access Granted', NULL, 'Inventory tools', 0, 'Tazaka Room : 10', 'Tazaka Room : 10', '2022-01-28 14:53:13', '2022-01-28 14:53:23'),
(770, '10', 10, 'Access Granted', NULL, 'Inventory tools', 0, 'Tazaka Room : 10', 'Tazaka Room : 10', '2022-01-28 16:39:10', '2022-01-28 16:39:17'),
(772, '10', 7, 'Access Granted', NULL, 'Inventory tools', 0, 'Tazaka Room : 10', 'Tazaka Room : 10', '2022-01-29 10:16:30', '2022-01-29 10:16:40'),
(780, '8', 7, 'Access Granted', NULL, 'Maintenance Chiller', 0, 'Tazaka Room : 8', 'Tazaka Room : 8', '2022-01-29 14:39:58', '2022-01-29 14:40:08'),
(783, '8', 7, 'Access Granted', NULL, 'Maintenance Mesin', 0, 'Tazaka Room : 8', 'Tazaka Room : 8', '2022-01-29 16:54:28', '2022-01-29 16:54:37'),
(829, '10', 10, 'Access Granted', NULL, '-', 0, 'Tazaka Room : 10', 'Tazaka Room : 10', '2022-01-29 17:58:27', '2022-01-29 17:58:27'),
(847, '6', 10, 'Access Granted', 'storage/doorlock/doorlock_access_847_31-01-2022.jpg', '-', 0, 'Tazaka Room : 6', 'Tazaka Room : 6', '2022-01-31 11:03:54', '2022-01-31 11:03:56'),
(852, '2', 7, 'Access Granted', NULL, '-', 1, 'Tazaka Room : 2', 'Tazaka Room : 2', '2022-02-02 16:25:48', '2022-02-02 16:25:54'),
(853, '8', 7, 'Access Granted', 'storage/doorlock/doorlock_access_853_02-02-2022.jpg', 'Maintenance Mesin', 0, 'Tazaka Room : 8', 'Tazaka Room : 8', '2022-02-02 16:26:54', '2022-02-02 16:27:06'),
(862, '8', 7, 'Access Granted', 'storage/doorlock/doorlock_access_862_03-02-2022.jpg', 'Maintenance Mesin', 1, 'Tazaka Room : 8', 'Tazaka Room : 8', '2022-02-03 08:17:32', '2022-02-03 08:17:49'),
(863, '10', 7, 'Access Granted', 'storage/doorlock/doorlock_access_863_03-02-2022.jpg', 'Inventory tools', 0, 'Tazaka Room : 10', 'Tazaka Room : 10', '2022-02-03 10:45:19', '2022-02-03 10:45:28'),
(864, '11', 7, 'Access Granted', NULL, '-', 2, 'Tazaka Room : 11', 'Tazaka Room : 11', '2022-02-03 10:45:46', '2022-02-03 10:45:52'),
(865, '10', 7, 'Access Granted', 'storage/doorlock/doorlock_access_865_03-02-2022.jpg', 'Inventory tools', 0, 'Tazaka Room : 10', 'Tazaka Room : 10', '2022-02-03 10:49:51', '2022-02-03 10:50:01'),
(866, '2', 7, 'Access Granted', NULL, '-', 1, 'Tazaka Room : 2', 'Tazaka Room : 2', '2022-02-03 10:51:22', '2022-02-03 10:51:28'),
(867, '2', 7, 'Access Granted', NULL, '-', 0, 'Tazaka Room : 2', 'Tazaka Room : 2', '2022-02-03 11:09:12', '2022-02-03 11:09:12'),
(868, '10', 7, 'Access Granted', 'storage/doorlock/doorlock_access_868_03-02-2022.jpg', 'Mengambil Bor', 0, 'Tazaka Room : 10', 'Tazaka Room : 10', '2022-02-03 11:17:01', '2022-02-03 11:17:11'),
(869, '10', 10, 'Access Granted', 'storage/doorlock/doorlock_access_869_03-02-2022.jpg', 'Inventory tools', 0, 'Tazaka Room : 10', 'Tazaka Room : 10', '2022-02-03 11:26:12', '2022-02-03 11:26:24'),
(870, '10', 7, 'Access Granted', 'storage/doorlock/doorlock_access_870_03-02-2022.jpg', 'Inventory tools', 0, 'Tazaka Room : 10', 'Tazaka Room : 10', '2022-02-03 11:50:11', '2022-02-03 11:50:22'),
(871, '4', 7, 'Access Granted', 'storage/doorlock/doorlock_access_871_03-02-2022.jpg', 'Mengambil barang gudang 3', 1, 'Tazaka Room : 4', 'Tazaka Room : 4', '2022-02-03 12:00:14', '2022-02-03 12:00:34'),
(873, '6', 7, 'Access Granted', 'storage/doorlock/doorlock_access_873_03-02-2022.jpg', '-', 0, 'Tazaka Room : 6', 'Tazaka Room : 6', '2022-02-03 13:13:32', '2022-02-03 13:13:34'),
(874, '6', 7, 'Access Granted', 'storage/doorlock/doorlock_access_874_03-02-2022.jpg', '-', 1, 'Tazaka Room : 6', 'Tazaka Room : 6', '2022-02-03 13:13:47', '2022-02-03 13:13:52'),
(875, '6', 7, 'Access Granted', 'storage/doorlock/doorlock_access_875_03-02-2022.jpg', '-', 0, 'Tazaka Room : 6', 'Tazaka Room : 6', '2022-02-03 13:45:30', '2022-02-03 13:45:32'),
(876, '10', 7, 'Access Granted', 'storage/doorlock/doorlock_access_876_03-02-2022.jpg', 'Inventory tools', 0, 'Tazaka Room : 10', 'Tazaka Room : 10', '2022-02-03 13:53:54', '2022-02-03 13:54:03'),
(877, '8', 7, 'Access Granted', 'storage/doorlock/doorlock_access_877_03-02-2022.jpg', 'Maintenance Mesin', 0, 'Tazaka Room : 8', 'Tazaka Room : 8', '2022-02-03 14:26:12', '2022-02-03 14:26:21'),
(878, '10', 7, 'Access Granted', 'storage/doorlock/doorlock_access_878_03-02-2022.jpg', 'Inventory tools', 0, 'Tazaka Room : 10', 'Tazaka Room : 10', '2022-02-03 16:30:47', '2022-02-03 16:30:54'),
(881, '6', 7, 'Access Granted', 'storage/doorlock/doorlock_access_881_04-02-2022.jpg', '-', 1, 'Tazaka Room : 6', 'Tazaka Room : 6', '2022-02-04 09:31:15', '2022-02-04 09:31:21'),
(882, '6', 7, 'Access Granted', 'storage/doorlock/doorlock_access_882_04-02-2022.jpg', '-', 0, 'Tazaka Room : 6', 'Tazaka Room : 6', '2022-02-04 10:44:26', '2022-02-04 10:44:28'),
(883, '11', 7, 'Access Granted', NULL, '-', 0, 'Tazaka Room : 11', 'Tazaka Room : 11', '2022-02-04 13:19:05', '2022-02-04 13:19:05'),
(887, '8', 10, 'Access Granted', 'storage/doorlock/doorlock_access_887_04-02-2022.jpg', 'Maintenance Chiller', 0, 'Tazaka Room : 8', 'Tazaka Room : 8', '2022-02-04 14:31:23', '2022-02-04 14:31:32'),
(888, '8', 7, 'Access Granted', 'storage/doorlock/doorlock_access_888_04-02-2022.jpg', '-', 0, 'Tazaka Room : 8', 'Tazaka Room : 8', '2022-02-04 14:37:38', '2022-02-04 14:37:40'),
(889, '8', 7, 'Access Granted', 'storage/doorlock/doorlock_access_889_04-02-2022.jpg', '-', 0, 'Tazaka Room : 8', 'Tazaka Room : 8', '2022-02-04 14:37:43', '2022-02-04 14:37:44'),
(890, '8', 7, 'Access Granted', 'storage/doorlock/doorlock_access_890_04-02-2022.jpg', '-', 0, 'Tazaka Room : 8', 'Tazaka Room : 8', '2022-02-04 14:37:58', '2022-02-04 14:38:00'),
(891, '8', 7, 'Access Granted', 'storage/doorlock/doorlock_access_891_04-02-2022.jpg', 'Maintenance Chiller', 0, 'Tazaka Room : 8', 'Tazaka Room : 8', '2022-02-04 14:38:05', '2022-02-04 14:38:17'),
(892, '10', 10, 'Access Granted', 'storage/doorlock/doorlock_access_892_04-02-2022.jpg', 'Inventory tools', 0, 'Tazaka Room : 10', 'Tazaka Room : 10', '2022-02-04 15:07:20', '2022-02-04 15:07:28'),
(893, '10', 7, 'Access Granted', 'storage/doorlock/doorlock_access_893_04-02-2022.jpg', '-', 0, 'Tazaka Room : 10', 'Tazaka Room : 10', '2022-02-04 15:18:45', '2022-02-04 15:18:47'),
(894, '10', 7, 'Access Granted', 'storage/doorlock/doorlock_access_894_04-02-2022.jpg', 'Inventory tools', 0, 'Tazaka Room : 10', 'Tazaka Room : 10', '2022-02-04 15:18:51', '2022-02-04 15:18:57'),
(895, '10', 7, 'Access Granted', 'storage/doorlock/doorlock_access_895_04-02-2022.jpg', 'Inventory tools', 0, 'Tazaka Room : 10', 'Tazaka Room : 10', '2022-02-04 16:19:10', '2022-02-04 16:19:20'),
(896, '10', 10, 'Access Granted', 'storage/doorlock/doorlock_access_896_04-02-2022.jpg', 'Inventory tools', 0, 'Tazaka Room : 10', 'Tazaka Room : 10', '2022-02-04 16:35:22', '2022-02-04 16:35:35'),
(898, '11', 7, 'Access Granted', NULL, '-', 0, 'Tazaka Room : 11', 'Tazaka Room : 11', '2022-02-05 15:22:29', '2022-02-05 15:22:29'),
(899, '6', 7, 'Access Granted', 'storage/doorlock/doorlock_access_899_05-02-2022.jpg', '-', 0, 'Tazaka Room : 6', 'Tazaka Room : 6', '2022-02-05 15:23:49', '2022-02-05 15:23:51'),
(900, '6', 7, 'Access Granted', 'storage/doorlock/doorlock_access_900_05-02-2022.jpg', '-', 1, 'Tazaka Room : 6', 'Tazaka Room : 6', '2022-02-05 15:23:57', '2022-02-05 15:24:03'),
(901, '10', 10, 'Access Granted', 'storage/doorlock/doorlock_access_901_05-02-2022.jpg', 'Inventory tools', 0, 'Tazaka Room : 10', 'Tazaka Room : 10', '2022-02-05 15:36:00', '2022-02-05 15:36:08'),
(902, '8', 10, 'Access Granted', 'storage/doorlock/doorlock_access_902_06-02-2022.jpg', 'Maintenance Mesin', 0, 'Tazaka Room : 8', 'Tazaka Room : 8', '2022-02-06 19:46:23', '2022-02-06 19:46:33'),
(903, '8', 10, 'Access Granted', 'storage/doorlock/doorlock_access_903_07-02-2022.jpg', 'Maintenance Chiller', 0, 'Tazaka Room : 8', 'Tazaka Room : 8', '2022-02-07 06:21:34', '2022-02-07 06:21:48'),
(904, '10', 10, 'Access Granted', 'storage/doorlock/doorlock_access_904_07-02-2022.jpg', 'Inventory tools', 1, 'Tazaka Room : 10', 'Tazaka Room : 10', '2022-02-07 08:40:17', '2022-02-07 08:40:32'),
(906, '10', 10, 'Access Granted', 'storage/doorlock/doorlock_access_906_07-02-2022.jpg', 'Inventory tools', 0, 'Tazaka Room : 10', 'Tazaka Room : 10', '2022-02-07 11:20:46', '2022-02-07 11:20:56'),
(907, '10', 10, 'Access Granted', 'storage/doorlock/doorlock_access_907_07-02-2022.jpg', 'Inventory tools', 0, 'Tazaka Room : 10', 'Tazaka Room : 10', '2022-02-07 11:35:01', '2022-02-07 11:35:10'),
(909, '10', 7, 'Access Granted', 'storage/doorlock/doorlock_access_909_07-02-2022.jpg', 'Inventory tools', 0, 'Tazaka Room : 10', 'Tazaka Room : 10', '2022-02-07 16:48:59', '2022-02-07 16:49:06'),
(910, '10', 7, 'Access Granted', 'storage/doorlock/doorlock_access_910_07-02-2022.jpg', 'Mengambil Bor', 0, 'Tazaka Room : 10', 'Tazaka Room : 10', '2022-02-07 17:04:29', '2022-02-07 17:04:43'),
(916, '10', 10, 'Access Granted', 'storage/doorlock/doorlock_access_916_08-02-2022.jpg', 'Inventory tools', 0, 'Tazaka Room : 10', 'Tazaka Room : 10', '2022-02-08 14:13:17', '2022-02-08 14:13:30'),
(923, '10', 7, 'Access Granted', 'storage/doorlock/doorlock_access_923_08-02-2022.jpg', 'Mengambil Bor', 0, 'Tazaka Room : 10', 'Tazaka Room : 10', '2022-02-08 15:39:52', '2022-02-08 15:40:00'),
(924, '6', 7, 'Access Granted', 'storage/doorlock/doorlock_access_924_08-02-2022.jpg', '-', 0, 'Tazaka Room : 6', 'Tazaka Room : 6', '2022-02-08 16:19:01', '2022-02-08 16:19:03'),
(925, '6', 7, 'Access Granted', 'storage/doorlock/doorlock_access_925_08-02-2022.jpg', '-', 1, 'Tazaka Room : 6', 'Tazaka Room : 6', '2022-02-08 16:19:12', '2022-02-08 16:19:17'),
(926, '6', 7, 'Access Granted', 'storage/doorlock/doorlock_access_926_08-02-2022.jpg', '-', 0, 'Tazaka Room : 6', 'Tazaka Room : 6', '2022-02-08 16:42:12', '2022-02-08 16:42:14'),
(927, '8', 7, 'Access Granted', 'storage/doorlock/doorlock_access_927_08-02-2022.jpg', 'Maintenance Mesin', 0, 'Tazaka Room : 8', 'Tazaka Room : 8', '2022-02-08 16:58:29', '2022-02-08 16:58:38'),
(941, '10', 10, 'Access Granted', 'storage/doorlock/doorlock_access_941_10-02-2022.jpg', 'Inventory tools', 0, 'Tazaka Room : 10', 'Tazaka Room : 10', '2022-02-10 08:20:13', '2022-02-10 08:20:24'),
(953, '6', 10, 'Access Granted', 'storage/doorlock/doorlock_access_953_10-02-2022.jpg', '-', 0, 'Tazaka Room : 6', 'Tazaka Room : 6', '2022-02-10 20:26:51', '2022-02-10 20:26:53'),
(954, '6', 10, 'Access Granted', 'storage/doorlock/doorlock_access_954_10-02-2022.jpg', '-', 0, 'Tazaka Room : 6', 'Tazaka Room : 6', '2022-02-10 20:27:00', '2022-02-10 20:27:01'),
(968, '8', 10, 'Access Granted', 'storage/doorlock/doorlock_access_968_12-02-2022.jpg', 'Maintenance Chiller', 0, 'Tazaka Room : 8', 'Tazaka Room : 8', '2022-02-12 20:13:15', '2022-02-12 20:13:26'),
(970, '8', 10, 'Access Granted', 'storage/doorlock/doorlock_access_970_13-02-2022.jpg', '-', 0, 'Tazaka Room : 8', 'Tazaka Room : 8', '2022-02-13 13:29:12', '2022-02-13 13:29:14'),
(971, '8', 10, 'Access Granted', 'storage/doorlock/doorlock_access_971_13-02-2022.jpg', 'Maintenance Chiller', 0, 'Tazaka Room : 8', 'Tazaka Room : 8', '2022-02-13 13:29:29', '2022-02-13 13:29:37'),
(972, '8', 10, 'Access Granted', 'storage/doorlock/doorlock_access_972_14-02-2022.jpg', 'Maintenance Chiller', 0, 'Tazaka Room : 8', 'Tazaka Room : 8', '2022-02-14 06:22:28', '2022-02-14 06:22:36'),
(981, '10', 10, 'Access Granted', 'storage/doorlock/doorlock_access_981_15-02-2022.jpg', 'Inventory tools', 0, 'Tazaka Room : 10', 'Tazaka Room : 10', '2022-02-15 09:54:29', '2022-02-15 09:54:38'),
(982, '10', 10, 'Access Granted', 'storage/doorlock/doorlock_access_982_15-02-2022.jpg', 'Inventory tools', 0, 'Tazaka Room : 10', 'Tazaka Room : 10', '2022-02-15 10:04:53', '2022-02-15 10:05:05'),
(1045, '8', 11, 'Access Granted', 'storage/doorlock/doorlock_access_1045_02-03-2022.jpg', '-', 0, 'Tazaka Room : 8', 'Tazaka Room : 8', '2022-03-02 10:12:27', '2022-03-02 10:12:28'),
(1046, '8', 11, 'Access Granted', 'storage/doorlock/doorlock_access_1046_02-03-2022.jpg', '-', 0, 'Tazaka Room : 8', 'Tazaka Room : 8', '2022-03-02 10:12:32', '2022-03-02 10:12:34'),
(1047, '8', 11, 'Access Granted', 'storage/doorlock/doorlock_access_1047_02-03-2022.jpg', '-', 0, 'Tazaka Room : 8', 'Tazaka Room : 8', '2022-03-02 10:12:44', '2022-03-02 10:12:46'),
(1056, '10', 10, 'Access Granted', 'storage/doorlock/doorlock_access_1056_03-03-2022.jpg', 'Mengambil Bor', 0, 'Tazaka Room : 10', 'Tazaka Room : 10', '2022-03-03 07:56:30', '2022-03-03 07:56:41'),
(1060, '6', 10, 'Access Granted', 'storage/doorlock/doorlock_access_1060_04-03-2022.jpg', '-', 0, 'Tazaka Room : 6', 'Tazaka Room : 6', '2022-03-04 11:07:03', '2022-03-04 11:07:04'),
(1073, '6', 4, 'Access Granted', 'storage/doorlock/doorlock_access_1073_17-03-2022.jpg', '-', 0, 'Tazaka Room : 6', 'Tazaka Room : 6', '2022-03-17 20:12:15', '2022-03-17 20:12:17'),
(1074, '10', 4, 'Access Granted', 'storage/doorlock/doorlock_access_1074_17-03-2022.jpg', 'Mengambil Bor', 1, 'Tazaka Room : 10', 'Tazaka Room : 10', '2022-03-17 20:18:28', '2022-03-17 20:19:08'),
(1075, '1', 4, 'Access Granted', 'storage/doorlock/doorlock_access_1075_17-03-2022.jpg', '-', 0, 'Tazaka Room : 1', 'Tazaka Room : 1', '2022-03-17 20:20:27', '2022-03-17 20:20:29'),
(1076, '2', 4, 'Access Granted', NULL, '-', 0, 'Tazaka Room : 2', 'Tazaka Room : 2', '2022-03-17 20:20:33', '2022-03-17 20:20:33'),
(1077, '1', 4, 'Access Granted', 'storage/doorlock/doorlock_access_1077_17-03-2022.jpg', '-', 0, 'Tazaka Room : 1', 'Tazaka Room : 1', '2022-03-17 20:20:38', '2022-03-17 20:20:40'),
(1078, '2', 4, 'Access Granted', NULL, '-', 0, 'Tazaka Room : 2', 'Tazaka Room : 2', '2022-03-17 20:20:44', '2022-03-17 20:20:44'),
(1079, '1', 4, 'Access Granted', 'storage/doorlock/doorlock_access_1079_17-03-2022.jpg', '-', 0, 'Tazaka Room : 1', 'Tazaka Room : 1', '2022-03-17 20:20:49', '2022-03-17 20:20:50'),
(1080, '7', 4, 'Access Granted', NULL, '-', 2, 'Tazaka Room : 7', 'Tazaka Room : 7', '2022-03-17 20:39:53', '2022-03-17 20:39:58'),
(1081, '6', 4, 'Access Granted', 'storage/doorlock/doorlock_access_1081_17-03-2022.jpg', '-', 0, 'Tazaka Room : 6', 'Tazaka Room : 6', '2022-03-17 21:11:17', '2022-03-17 21:11:20'),
(1082, '1', 4, 'Access Granted', 'storage/doorlock/doorlock_access_1082_17-03-2022.jpg', '-', 0, 'Tazaka Room : 1', 'Tazaka Room : 1', '2022-03-17 22:02:06', '2022-03-17 22:02:08'),
(1083, '1', 4, 'Access Granted', 'storage/doorlock/doorlock_access_1083_17-03-2022.jpg', '-', 0, 'Tazaka Room : 1', 'Tazaka Room : 1', '2022-03-17 22:02:18', '2022-03-17 22:02:20'),
(1084, '6', 4, 'Access Granted', 'storage/doorlock/doorlock_access_1084_17-03-2022.jpg', '-', 0, 'Tazaka Room : 6', 'Tazaka Room : 6', '2022-03-17 22:04:13', '2022-03-17 22:04:16'),
(1085, '1', 4, 'Access Granted', 'storage/doorlock/doorlock_access_1085_17-03-2022.jpg', '-', 0, 'Tazaka Room : 1', 'Tazaka Room : 1', '2022-03-17 22:14:15', '2022-03-17 22:14:17'),
(1086, '10', 4, 'Access Granted', 'storage/doorlock/doorlock_access_1086_17-03-2022.jpg', 'Mengambil Bor', 0, 'Tazaka Room : 10', 'Tazaka Room : 10', '2022-03-17 23:37:10', '2022-03-17 23:37:21'),
(1087, '3', 4, 'Access Granted', NULL, '-', 0, 'Tazaka Room : 3', 'Tazaka Room : 3', '2022-03-17 23:39:42', '2022-03-17 23:39:42'),
(1088, '5', 4, 'Access Granted', NULL, '-', 0, 'Tazaka Room : 5', 'Tazaka Room : 5', '2022-03-18 02:22:13', '2022-03-18 02:22:13'),
(1089, '8', 4, 'Access Granted', 'storage/doorlock/doorlock_access_1089_18-03-2022.jpg', 'Maintenance Chiller', 0, 'Tazaka Room : 8', 'Tazaka Room : 8', '2022-03-18 11:06:10', '2022-03-18 11:06:23'),
(1090, '8', 4, 'Access Granted', 'storage/doorlock/doorlock_access_1090_18-03-2022.jpg', 'Maintenance Chiller', 0, 'Tazaka Room : 8', 'Tazaka Room : 8', '2022-03-18 11:09:19', '2022-03-18 11:09:28'),
(1091, '8', 4, 'Access Granted', 'storage/doorlock/doorlock_access_1091_18-03-2022.jpg', 'Maintenance Mesin', 1, 'Tazaka Room : 8', 'Tazaka Room : 8', '2022-03-18 11:10:43', '2022-03-18 11:10:57'),
(1092, '10', 4, 'Access Granted', 'storage/doorlock/doorlock_access_1092_18-03-2022.jpg', 'Inventory tools', 0, 'Tazaka Room : 10', 'Tazaka Room : 10', '2022-03-18 11:56:38', '2022-03-18 11:56:47'),
(1093, '5', 4, 'Access Granted', NULL, '-', 1, 'Tazaka Room : 5', 'Tazaka Room : 5', '2022-03-18 12:56:18', '2022-03-18 12:56:23'),
(1094, '5', 4, 'Access Granted', NULL, '-', 0, 'Tazaka Room : 5', 'Tazaka Room : 5', '2022-03-18 12:59:47', '2022-03-18 12:59:47'),
(1095, '5', 4, 'Access Granted', NULL, '-', 1, 'Tazaka Room : 5', 'Tazaka Room : 5', '2022-03-18 13:00:03', '2022-03-18 13:00:09'),
(1096, '4', 4, 'Access Granted', 'storage/doorlock/doorlock_access_1096_18-03-2022.jpg', 'Mengambil barang gudang 3', 0, 'Tazaka Room : 4', 'Tazaka Room : 4', '2022-03-18 13:00:22', '2022-03-18 13:00:33'),
(1097, '4', 4, 'Access Granted', 'storage/doorlock/doorlock_access_1097_18-03-2022.jpg', 'Stock opname', 0, 'Tazaka Room : 4', 'Tazaka Room : 4', '2022-03-18 13:00:43', '2022-03-18 13:00:51'),
(1098, '4', 4, 'Access Granted', 'storage/doorlock/doorlock_access_1098_18-03-2022.jpg', 'Stock opname', 0, 'Tazaka Room : 4', 'Tazaka Room : 4', '2022-03-18 13:02:16', '2022-03-18 13:02:28'),
(1099, '5', 4, 'Access Granted', NULL, '-', 1, 'Tazaka Room : 5', 'Tazaka Room : 5', '2022-03-18 13:02:39', '2022-03-18 13:02:44'),
(1100, '5', 4, 'Access Granted', NULL, '-', 2, 'Tazaka Room : 5', 'Tazaka Room : 5', '2022-03-18 13:03:23', '2022-03-18 13:03:28'),
(1101, '4', 4, 'Access Granted', 'storage/doorlock/doorlock_access_1101_18-03-2022.jpg', '-', 0, 'Tazaka Room : 4', 'Tazaka Room : 4', '2022-03-18 13:04:03', '2022-03-18 13:04:05'),
(1102, '10', 4, 'Access Granted', 'storage/doorlock/doorlock_access_1102_18-03-2022.jpg', 'Mengambil Bor', 1, 'Tazaka Room : 10', 'Tazaka Room : 10', '2022-03-18 13:16:05', '2022-03-18 13:16:27'),
(1103, '8', 4, 'Access Granted', 'storage/doorlock/doorlock_access_1103_18-03-2022.jpg', 'Maintenance Chiller', 0, 'Tazaka Room : 8', 'Tazaka Room : 8', '2022-03-18 13:17:28', '2022-03-18 13:17:35'),
(1104, '9', 4, 'Access Granted', NULL, '-', 1, 'Tazaka Room : 9', 'Tazaka Room : 9', '2022-03-18 13:17:45', '2022-03-18 13:17:50'),
(1105, '9', 4, 'Access Granted', NULL, '-', 0, 'Tazaka Room : 9', 'Tazaka Room : 9', '2022-03-18 13:19:20', '2022-03-18 13:19:20'),
(1106, '8', 4, 'Access Granted', 'storage/doorlock/doorlock_access_1106_18-03-2022.jpg', 'Maintenance Chiller', 0, 'Tazaka Room : 8', 'Tazaka Room : 8', '2022-03-18 13:19:51', '2022-03-18 13:20:04'),
(1107, '9', 4, 'Access Granted', NULL, '-', 2, 'Tazaka Room : 9', 'Tazaka Room : 9', '2022-03-18 13:20:23', '2022-03-18 13:20:29'),
(1108, '10', 4, 'Access Granted', 'storage/doorlock/doorlock_access_1108_18-03-2022.jpg', 'Inventory tools', 0, 'Tazaka Room : 10', 'Tazaka Room : 10', '2022-03-18 13:27:04', '2022-03-18 13:27:13'),
(1113, '6', 10, 'Access Granted', 'storage/doorlock/doorlock_access_1113_19-03-2022.jpg', '-', 2, 'Tazaka Room : 6', 'Tazaka Room : 6', '2022-03-19 10:38:32', '2022-03-19 10:38:37'),
(1114, '6', 10, 'Access Granted', 'storage/doorlock/doorlock_access_1114_19-03-2022.jpg', '-', 0, 'Tazaka Room : 6', 'Tazaka Room : 6', '2022-03-19 11:13:44', '2022-03-19 11:13:46'),
(1116, '10', 10, 'Access Granted', 'storage/doorlock/doorlock_access_1116_21-03-2022.jpg', 'Mengambil Bor', 0, 'Tazaka Room : 10', 'Tazaka Room : 10', '2022-03-21 08:40:22', '2022-03-21 08:40:33'),
(1117, '10', 10, 'Access Granted', 'storage/doorlock/doorlock_access_1117_21-03-2022.jpg', 'Mengambil Bor', 0, 'Tazaka Room : 10', 'Tazaka Room : 10', '2022-03-21 11:15:41', '2022-03-21 11:15:52'),
(1118, '6', 10, 'Access Granted', 'storage/doorlock/doorlock_access_1118_21-03-2022.jpg', '-', 1, 'Tazaka Room : 6', 'Tazaka Room : 6', '2022-03-21 11:29:31', '2022-03-21 11:29:36'),
(1119, '6', 10, 'Access Granted', 'storage/doorlock/doorlock_access_1119_21-03-2022.jpg', '-', 2, 'Tazaka Room : 6', 'Tazaka Room : 6', '2022-03-21 11:35:09', '2022-03-21 11:35:15'),
(1120, '6', 10, 'Access Granted', 'storage/doorlock/doorlock_access_1120_22-03-2022.jpg', '-', 0, 'Tazaka Room : 6', 'Tazaka Room : 6', '2022-03-22 08:47:46', '2022-03-22 08:47:47'),
(1122, '10', 10, 'Access Granted', 'storage/doorlock/doorlock_access_1122_22-03-2022.jpg', 'Inventory tools', 1, 'Tazaka Room : 10', 'Tazaka Room : 10', '2022-03-22 20:28:29', '2022-03-22 20:28:43'),
(1123, '6', 10, 'Access Granted', 'storage/doorlock/doorlock_access_1123_25-03-2022.jpg', '-', 2, 'Tazaka Room : 6', 'Tazaka Room : 6', '2022-03-25 15:41:38', '2022-03-25 15:41:44'),
(1124, '4', 6, 'Access Granted', 'storage/doorlock/doorlock_access_1124_26-03-2022.jpg', '-', 0, 'Tazaka Room : 4', 'Tazaka Room : 4', '2022-03-26 13:12:23', '2022-03-26 13:12:25'),
(1125, '4', 6, 'Access Granted', 'storage/doorlock/doorlock_access_1125_26-03-2022.jpg', 'Stock opname', 0, 'Tazaka Room : 4', 'Tazaka Room : 4', '2022-03-26 13:12:28', '2022-03-26 13:12:38'),
(1126, '5', 6, 'Access Granted', NULL, '-', 0, 'Tazaka Room : 5', 'Tazaka Room : 5', '2022-03-26 13:12:46', '2022-03-26 13:12:46'),
(1127, '10', 6, 'Access Granted', 'storage/doorlock/doorlock_access_1127_26-03-2022.jpg', '-', 0, 'Tazaka Room : 10', 'Tazaka Room : 10', '2022-03-26 13:13:33', '2022-03-26 13:13:35'),
(1128, '10', 6, 'Access Granted', 'storage/doorlock/doorlock_access_1128_26-03-2022.jpg', 'Inventory tools', 1, 'Tazaka Room : 10', 'Tazaka Room : 10', '2022-03-26 13:13:38', '2022-03-26 13:13:59'),
(1129, '11', 6, 'Access Granted', NULL, '-', 1, 'Tazaka Room : 11', 'Tazaka Room : 11', '2022-03-26 13:14:04', '2022-03-26 13:14:10'),
(1130, '8', 6, 'Access Granted', 'storage/doorlock/doorlock_access_1130_26-03-2022.jpg', 'Maintenance Mesin', 1, 'Tazaka Room : 8', 'Tazaka Room : 8', '2022-03-26 13:15:31', '2022-03-26 13:16:04'),
(1131, '9', 6, 'Access Granted', NULL, '-', 1, 'Tazaka Room : 9', 'Tazaka Room : 9', '2022-03-26 13:15:40', '2022-03-26 13:15:46'),
(1132, '1', 6, 'Access Granted', 'storage/doorlock/doorlock_access_1132_26-03-2022.jpg', '-', 0, 'Tazaka Room : 1', 'Tazaka Room : 1', '2022-03-26 13:18:38', '2022-03-26 13:18:39'),
(1133, '4', 6, 'Access Granted', 'storage/doorlock/doorlock_access_1133_26-03-2022.jpg', 'Stock opname', 0, 'Tazaka Room : 4', 'Tazaka Room : 4', '2022-03-26 13:23:02', '2022-03-26 13:23:19'),
(1134, '5', 6, 'Access Granted', NULL, '-', 1, 'Tazaka Room : 5', 'Tazaka Room : 5', '2022-03-26 13:23:35', '2022-03-26 13:23:40'),
(1135, '10', 10, 'Access Granted', 'storage/doorlock/doorlock_access_1135_27-03-2022.jpg', 'Mengambil Bor', 0, 'Tazaka Room : 10', 'Tazaka Room : 10', '2022-03-27 10:59:38', '2022-03-27 10:59:45'),
(1136, '6', 10, 'Access Granted', 'storage/doorlock/doorlock_access_1136_28-03-2022.jpg', '-', 2, 'Tazaka Room : 6', 'Tazaka Room : 6', '2022-03-28 08:46:18', '2022-03-28 08:46:23'),
(1137, '10', 10, 'Access Granted', 'storage/doorlock/doorlock_access_1137_29-03-2022.jpg', 'Mengambil Bor', 1, 'Tazaka Room : 10', 'Tazaka Room : 10', '2022-03-29 08:27:45', '2022-03-29 08:28:03'),
(1138, '6', 10, 'Access Granted', 'storage/doorlock/doorlock_access_1138_29-03-2022.jpg', '-', 0, 'Tazaka Room : 6', 'Tazaka Room : 6', '2022-03-29 11:04:03', '2022-03-29 11:04:05'),
(1152, '8', 10, 'Access Granted', 'storage/doorlock/doorlock_access_1152_04-04-2022.jpg', '-', 0, 'Tazaka Room : 8', 'Tazaka Room : 8', '2022-04-04 06:08:18', '2022-04-04 06:08:20'),
(1153, '8', 10, 'Access Granted', 'storage/doorlock/doorlock_access_1153_04-04-2022.jpg', 'Maintenance Mesin', 1, 'Tazaka Room : 8', 'Tazaka Room : 8', '2022-04-04 06:08:36', '2022-04-04 06:09:23'),
(1155, '6', 10, 'Access Granted', 'storage/doorlock/doorlock_access_1155_04-04-2022.jpg', '-', 0, 'Tazaka Room : 6', 'Tazaka Room : 6', '2022-04-04 15:57:58', '2022-04-04 15:58:00'),
(1156, '6', 10, 'Access Granted', 'storage/doorlock/doorlock_access_1156_06-04-2022.jpg', '-', 1, 'Tazaka Room : 6', 'Tazaka Room : 6', '2022-04-06 10:07:42', '2022-04-06 10:07:47'),
(1157, '6', 10, 'Access Granted', 'storage/doorlock/doorlock_access_1157_06-04-2022.jpg', '-', 1, 'Tazaka Room : 6', 'Tazaka Room : 6', '2022-04-06 10:07:54', '2022-04-06 10:07:59'),
(1158, '6', 10, 'Access Granted', 'storage/doorlock/doorlock_access_1158_06-04-2022.jpg', '-', 0, 'Tazaka Room : 6', 'Tazaka Room : 6', '2022-04-06 10:08:04', '2022-04-06 10:08:05'),
(1167, '6', 10, 'Access Granted', 'storage/doorlock/doorlock_access_1167_09-04-2022.jpg', '-', 0, 'Tazaka Room : 6', 'Tazaka Room : 6', '2022-04-09 18:35:28', '2022-04-09 18:35:30'),
(1188, '6', 10, 'Access Granted', 'storage/doorlock/doorlock_access_1188_25-04-2022.jpg', '-', 0, 'Tazaka Room : 6', 'Tazaka Room : 6', '2022-04-25 09:09:21', '2022-04-25 09:09:23'),
(1189, '6', 10, 'Access Granted', 'storage/doorlock/doorlock_access_1189_26-04-2022.jpg', '-', 0, 'Tazaka Room : 6', 'Tazaka Room : 6', '2022-04-26 07:36:16', '2022-04-26 07:36:18'),
(1190, '6', 10, 'Access Granted', 'storage/doorlock/doorlock_access_1190_27-04-2022.jpg', '-', 0, 'Tazaka Room : 6', 'Tazaka Room : 6', '2022-04-27 08:15:09', '2022-04-27 08:15:11'),
(1210, '6', 33, 'Access Granted', 'storage/doorlock/doorlock_access_1210_24-05-2022.jpg', '-', 1, 'Tazaka Room : 6', 'Tazaka Room : 6', '2022-05-24 09:11:36', '2022-05-24 09:11:44'),
(1211, '4', 33, 'Access Granted', 'storage/doorlock/doorlock_access_1211_25-05-2022.jpg', 'Mengambil barang gudang 3', 0, 'Tazaka Room : 4', 'Tazaka Room : 4', '2022-05-25 17:13:39', '2022-05-25 17:13:50'),
(1212, '4', 38, 'Access Granted', 'storage/doorlock/doorlock_access_1212_27-05-2022.jpg', '-', 0, 'Tazaka Room : 4', 'Tazaka Room : 4', '2022-05-27 08:00:09', '2022-05-27 08:00:11'),
(1213, '10', 42, 'Access Granted', 'storage/doorlock/doorlock_access_1213_27-05-2022.jpg', 'Inventory tools', 0, 'Tazaka Room : 10', 'Tazaka Room : 10', '2022-05-27 09:28:31', '2022-05-27 09:28:42'),
(1214, '11', 42, 'Access Granted', NULL, '-', 0, 'Tazaka Room : 11', 'Tazaka Room : 11', '2022-05-27 09:29:19', '2022-05-27 09:29:19'),
(1215, '10', 41, 'Access Granted', 'storage/doorlock/doorlock_access_1215_27-05-2022.jpg', 'Inventory tools', 0, 'Tazaka Room : 10', 'Tazaka Room : 10', '2022-05-27 09:34:41', '2022-05-27 09:35:05'),
(1216, '10', 43, 'Access Granted', 'storage/doorlock/doorlock_access_1216_27-05-2022.jpg', '-', 0, 'Tazaka Room : 10', 'Tazaka Room : 10', '2022-05-27 09:37:08', '2022-05-27 09:37:10'),
(1217, '10', 43, 'Access Granted', 'storage/doorlock/doorlock_access_1217_27-05-2022.jpg', '-', 0, 'Tazaka Room : 10', 'Tazaka Room : 10', '2022-05-27 09:37:13', '2022-05-27 09:37:15'),
(1218, '10', 43, 'Access Granted', 'storage/doorlock/doorlock_access_1218_27-05-2022.jpg', '-', 0, 'Tazaka Room : 10', 'Tazaka Room : 10', '2022-05-27 09:37:20', '2022-05-27 09:37:22'),
(1219, '10', 43, 'Access Granted', 'storage/doorlock/doorlock_access_1219_27-05-2022.jpg', 'Mengambil Bor', 0, 'Tazaka Room : 10', 'Tazaka Room : 10', '2022-05-27 09:37:25', '2022-05-27 09:37:32'),
(1220, '4', 46, 'Access Granted', 'storage/doorlock/doorlock_access_1220_27-05-2022.jpg', 'Mengambil barang gudang 3', 0, 'Tazaka Room : 4', 'Tazaka Room : 4', '2022-05-27 10:04:26', '2022-05-27 10:04:37'),
(1221, '5', 46, 'Access Granted', NULL, '-', 2, 'Tazaka Room : 5', 'Tazaka Room : 5', '2022-05-27 10:04:55', '2022-05-27 10:05:01'),
(1222, '5', 38, 'Access Granted', NULL, '-', 1, 'Tazaka Room : 5', 'Tazaka Room : 5', '2022-05-27 10:06:20', '2022-05-27 10:06:26'),
(1223, '5', 38, 'Access Granted', NULL, '-', 0, 'Tazaka Room : 5', 'Tazaka Room : 5', '2022-05-27 10:06:49', '2022-05-27 10:06:49'),
(1224, '10', 45, 'Access Granted', 'storage/doorlock/doorlock_access_1224_27-05-2022.jpg', '-', 0, 'Tazaka Room : 10', 'Tazaka Room : 10', '2022-05-27 10:07:03', '2022-05-27 10:07:05'),
(1225, '10', 45, 'Access Granted', 'storage/doorlock/doorlock_access_1225_27-05-2022.jpg', 'Mengambil Bor', 0, 'Tazaka Room : 10', 'Tazaka Room : 10', '2022-05-27 10:07:19', '2022-05-27 10:07:29'),
(1226, '10', 45, 'Access Granted', 'storage/doorlock/doorlock_access_1226_27-05-2022.jpg', 'Mengambil Bor', 0, 'Tazaka Room : 10', 'Tazaka Room : 10', '2022-05-27 10:07:39', '2022-05-27 10:07:48'),
(1227, '10', 10, 'Access Granted', 'storage/doorlock/doorlock_access_1227_27-05-2022.jpg', 'Inventory tools', 0, 'Tazaka Room : 10', 'Tazaka Room : 10', '2022-05-27 10:42:41', '2022-05-27 10:42:52'),
(1228, '10', 32, 'Access Granted', 'storage/doorlock/doorlock_access_1228_28-05-2022.jpg', 'Inventory tools', 0, 'Tazaka Room : 10', 'Tazaka Room : 10', '2022-05-28 10:32:00', '2022-05-28 10:32:11'),
(1229, '6', 30, 'Access Granted', 'storage/doorlock/doorlock_access_1229_28-05-2022.jpg', '-', 0, 'Tazaka Room : 6', 'Tazaka Room : 6', '2022-05-28 10:34:03', '2022-05-28 10:34:05'),
(1230, '10', 30, 'Access Granted', 'storage/doorlock/doorlock_access_1230_28-05-2022.jpg', '-', 0, 'Tazaka Room : 10', 'Tazaka Room : 10', '2022-05-28 10:35:46', '2022-05-28 10:35:47'),
(1231, '10', 30, 'Access Granted', 'storage/doorlock/doorlock_access_1231_28-05-2022.jpg', 'Mengambil Bor', 0, 'Tazaka Room : 10', 'Tazaka Room : 10', '2022-05-28 10:35:50', '2022-05-28 10:36:00'),
(1232, '10', 10, 'Access Granted', 'storage/doorlock/doorlock_access_1232_28-05-2022.jpg', 'Mengambil Bor', 0, 'Tazaka Room : 10', 'Tazaka Room : 10', '2022-05-28 10:57:34', '2022-05-28 10:57:42'),
(1233, '10', 10, 'Access Granted', 'storage/doorlock/doorlock_access_1233_28-05-2022.jpg', 'Mengambil Bor', 0, 'Tazaka Room : 10', 'Tazaka Room : 10', '2022-05-28 11:55:50', '2022-05-28 11:55:58'),
(1234, '10', 45, 'Access Granted', 'storage/doorlock/doorlock_access_1234_28-05-2022.jpg', 'Mengambil Bor', 0, 'Tazaka Room : 10', 'Tazaka Room : 10', '2022-05-28 12:13:02', '2022-05-28 12:13:13'),
(1235, '10', 54, 'Access Granted', 'storage/doorlock/doorlock_access_1235_28-05-2022.jpg', 'Inventory tools', 0, 'Tazaka Room : 10', 'Tazaka Room : 10', '2022-05-28 14:03:05', '2022-05-28 14:03:18'),
(1236, '4', 54, 'Access Granted', 'storage/doorlock/doorlock_access_1236_28-05-2022.jpg', '-', 0, 'Tazaka Room : 4', 'Tazaka Room : 4', '2022-05-28 14:05:30', '2022-05-28 14:05:31'),
(1237, '6', 54, 'Access Granted', 'storage/doorlock/doorlock_access_1237_28-05-2022.jpg', '-', 0, 'Tazaka Room : 6', 'Tazaka Room : 6', '2022-05-28 14:07:09', '2022-05-28 14:07:11'),
(1238, '6', 36, 'Access Granted', 'storage/doorlock/doorlock_access_1238_28-05-2022.jpg', '-', 1, 'Tazaka Room : 6', 'Tazaka Room : 6', '2022-05-28 14:14:59', '2022-05-28 14:15:04'),
(1239, '6', 37, 'Access Granted', 'storage/doorlock/doorlock_access_1239_28-05-2022.jpg', '-', 0, 'Tazaka Room : 6', 'Tazaka Room : 6', '2022-05-28 14:15:46', '2022-05-28 14:15:47'),
(1240, '10', 79, 'Access Granted', 'storage/doorlock/doorlock_access_1240_28-05-2022.jpg', '-', 0, 'Tazaka Room : 10', 'Tazaka Room : 10', '2022-05-28 14:41:33', '2022-05-28 14:41:35'),
(1241, '10', 79, 'Access Granted', 'storage/doorlock/doorlock_access_1241_28-05-2022.jpg', 'Inventory tools', 0, 'Tazaka Room : 10', 'Tazaka Room : 10', '2022-05-28 14:41:38', '2022-05-28 14:42:32'),
(1242, '11', 43, 'Access Granted', NULL, '-', 0, 'Tazaka Room : 11', 'Tazaka Room : 11', '2022-05-28 14:43:48', '2022-05-28 14:43:48'),
(1243, '10', 41, 'Access Granted', 'storage/doorlock/doorlock_access_1243_28-05-2022.jpg', 'Mengambil Bor', 0, 'Tazaka Room : 10', 'Tazaka Room : 10', '2022-05-28 14:45:36', '2022-05-28 14:45:46'),
(1244, '11', 41, 'Access Granted', NULL, '-', 1, 'Tazaka Room : 11', 'Tazaka Room : 11', '2022-05-28 14:46:31', '2022-05-28 14:46:36'),
(1245, '10', 79, 'Access Granted', 'storage/doorlock/doorlock_access_1245_28-05-2022.jpg', '-', 0, 'Tazaka Room : 10', 'Tazaka Room : 10', '2022-05-28 14:56:29', '2022-05-28 14:56:31'),
(1246, '10', 79, 'Access Granted', 'storage/doorlock/doorlock_access_1246_28-05-2022.jpg', 'Mengambil Bor', 0, 'Tazaka Room : 10', 'Tazaka Room : 10', '2022-05-28 14:56:35', '2022-05-28 14:56:54'),
(1247, '10', 79, 'Access Granted', 'storage/doorlock/doorlock_access_1247_28-05-2022.jpg', 'Mengambil Bor', 0, 'Tazaka Room : 10', 'Tazaka Room : 10', '2022-05-28 14:57:06', '2022-05-28 14:58:34'),
(1248, '10', 43, 'Access Granted', 'storage/doorlock/doorlock_access_1248_28-05-2022.jpg', '-', 0, 'Tazaka Room : 10', 'Tazaka Room : 10', '2022-05-28 14:58:53', '2022-05-28 14:58:55'),
(1249, '10', 43, 'Access Granted', 'storage/doorlock/doorlock_access_1249_28-05-2022.jpg', 'Inventory tools', 0, 'Tazaka Room : 10', 'Tazaka Room : 10', '2022-05-28 14:58:59', '2022-05-28 14:59:07');
INSERT INTO `doorlock_reports` (`id`, `uid`, `user_id`, `keterangan`, `doorlock_photo_path`, `remark_log`, `count_access`, `createdBy`, `updatedBy`, `created_at`, `updated_at`) VALUES
(1250, '11', 42, 'Access Granted', NULL, '-', 0, 'Tazaka Room : 11', 'Tazaka Room : 11', '2022-05-28 15:00:47', '2022-05-28 15:00:47'),
(1251, '4', 38, 'Access Granted', 'storage/doorlock/doorlock_access_1251_28-05-2022.jpg', '-', 0, 'Tazaka Room : 4', 'Tazaka Room : 4', '2022-05-28 15:34:57', '2022-05-28 15:34:58'),
(1252, '6', 11, 'Access Granted', 'storage/doorlock/doorlock_access_1252_28-05-2022.jpg', '-', 1, 'Tazaka Room : 6', 'Tazaka Room : 6', '2022-05-28 15:40:14', '2022-05-28 15:40:20'),
(1253, '10', 65, 'Access Granted', 'storage/doorlock/doorlock_access_1253_28-05-2022.jpg', 'Mengambil Bor', 0, 'Tazaka Room : 10', 'Tazaka Room : 10', '2022-05-28 15:40:36', '2022-05-28 15:40:56'),
(1254, '10', 10, 'Access Granted', 'storage/doorlock/doorlock_access_1254_28-05-2022.jpg', 'Inventory tools', 1, 'Tazaka Room : 10', 'Tazaka Room : 10', '2022-05-28 16:08:25', '2022-05-28 16:08:41'),
(1255, '10', 41, 'Access Granted', 'storage/doorlock/doorlock_access_1255_28-05-2022.jpg', 'Inventory tools', 0, 'Tazaka Room : 10', 'Tazaka Room : 10', '2022-05-28 17:57:00', '2022-05-28 17:57:11'),
(1256, '10', 42, 'Access Granted', 'storage/doorlock/doorlock_access_1256_28-05-2022.jpg', 'Inventory tools', 0, 'Tazaka Room : 10', 'Tazaka Room : 10', '2022-05-28 19:31:31', '2022-05-28 19:31:42'),
(1257, '4', 31, 'Access Granted', 'storage/doorlock/doorlock_access_1257_30-05-2022.jpg', 'Stock opname', 0, 'Tazaka Room : 4', 'Tazaka Room : 4', '2022-05-30 07:04:10', '2022-05-30 07:04:21'),
(1258, '10', 54, 'Access Granted', 'storage/doorlock/doorlock_access_1258_30-05-2022.jpg', '-', 0, 'Tazaka Room : 10', 'Tazaka Room : 10', '2022-05-30 08:05:12', '2022-05-30 08:05:14'),
(1259, '10', 54, 'Access Granted', 'storage/doorlock/doorlock_access_1259_30-05-2022.jpg', 'Inventory tools', 0, 'Tazaka Room : 10', 'Tazaka Room : 10', '2022-05-30 08:05:19', '2022-05-30 08:05:25'),
(1260, '10', 30, 'Access Granted', 'storage/doorlock/doorlock_access_1260_30-05-2022.jpg', 'Mengambil Bor', 0, 'Tazaka Room : 10', 'Tazaka Room : 10', '2022-05-30 10:08:04', '2022-05-30 10:08:23'),
(1261, '4', 38, 'Access Granted', 'storage/doorlock/doorlock_access_1261_30-05-2022.jpg', 'Mengambil barang gudang 3', 0, 'Tazaka Room : 4', 'Tazaka Room : 4', '2022-05-30 16:54:13', '2022-05-30 16:54:26'),
(1262, '4', 46, 'Access Granted', 'storage/doorlock/doorlock_access_1262_30-05-2022.jpg', 'Stock opname', 0, 'Tazaka Room : 4', 'Tazaka Room : 4', '2022-05-30 16:59:25', '2022-05-30 16:59:40'),
(1263, '4', 46, 'Access Granted', 'storage/doorlock/doorlock_access_1263_30-05-2022.jpg', 'Mengambil barang gudang 3', 0, 'Tazaka Room : 4', 'Tazaka Room : 4', '2022-05-30 18:32:52', '2022-05-30 18:33:02'),
(1264, '4', 36, 'Access Granted', 'storage/doorlock/doorlock_access_1264_30-05-2022.jpg', 'Mengambil barang gudang 3', 0, 'Tazaka Room : 4', 'Tazaka Room : 4', '2022-05-30 19:14:52', '2022-05-30 19:15:14'),
(1265, '4', 36, 'Access Granted', 'storage/doorlock/doorlock_access_1265_30-05-2022.jpg', 'Mengambil barang gudang 3', 0, 'Tazaka Room : 4', 'Tazaka Room : 4', '2022-05-30 19:28:23', '2022-05-30 19:28:59'),
(1266, '10', 43, 'Access Granted', 'storage/doorlock/doorlock_access_1266_30-05-2022.jpg', '-', 0, 'Tazaka Room : 10', 'Tazaka Room : 10', '2022-05-30 20:14:17', '2022-05-30 20:14:19'),
(1267, '10', 43, 'Access Granted', 'storage/doorlock/doorlock_access_1267_30-05-2022.jpg', 'Mengambil Bor', 0, 'Tazaka Room : 10', 'Tazaka Room : 10', '2022-05-30 20:14:22', '2022-05-30 20:14:35'),
(1268, '10', 43, 'Access Granted', 'storage/doorlock/doorlock_access_1268_30-05-2022.jpg', '-', 0, 'Tazaka Room : 10', 'Tazaka Room : 10', '2022-05-30 20:54:35', '2022-05-30 20:54:37'),
(1269, '10', 43, 'Access Granted', 'storage/doorlock/doorlock_access_1269_30-05-2022.jpg', 'Mengambil Bor', 0, 'Tazaka Room : 10', 'Tazaka Room : 10', '2022-05-30 20:54:40', '2022-05-30 20:54:52'),
(1270, '10', 42, 'Access Granted', 'storage/doorlock/doorlock_access_1270_30-05-2022.jpg', 'Inventory tools', 0, 'Tazaka Room : 10', 'Tazaka Room : 10', '2022-05-30 23:37:00', '2022-05-30 23:37:13'),
(1271, '4', 36, 'Access Granted', 'storage/doorlock/doorlock_access_1271_31-05-2022.jpg', 'Stock opname', 0, 'Tazaka Room : 4', 'Tazaka Room : 4', '2022-05-31 00:40:15', '2022-05-31 00:40:31'),
(1272, '4', 36, 'Access Granted', 'storage/doorlock/doorlock_access_1272_31-05-2022.jpg', 'Mengambil barang gudang 3', 0, 'Tazaka Room : 4', 'Tazaka Room : 4', '2022-05-31 00:58:27', '2022-05-31 00:58:49'),
(1273, '4', 36, 'Access Granted', 'storage/doorlock/doorlock_access_1273_31-05-2022.jpg', 'Mengambil barang gudang 3', 0, 'Tazaka Room : 4', 'Tazaka Room : 4', '2022-05-31 00:59:04', '2022-05-31 00:59:13'),
(1274, '4', 36, 'Access Granted', 'storage/doorlock/doorlock_access_1274_31-05-2022.jpg', 'Mengambil barang gudang 3', 0, 'Tazaka Room : 4', 'Tazaka Room : 4', '2022-05-31 02:10:24', '2022-05-31 02:10:47'),
(1275, '4', 36, 'Access Granted', 'storage/doorlock/doorlock_access_1275_31-05-2022.jpg', 'Mengambil barang gudang 3', 0, 'Tazaka Room : 4', 'Tazaka Room : 4', '2022-05-31 02:40:06', '2022-05-31 02:40:24'),
(1276, '4', 56, 'Access Granted', 'storage/doorlock/doorlock_access_1276_31-05-2022.jpg', 'Mengambil barang gudang 3', 0, 'Tazaka Room : 4', 'Tazaka Room : 4', '2022-05-31 03:06:53', '2022-05-31 03:07:06'),
(1277, '4', 56, 'Access Granted', 'storage/doorlock/doorlock_access_1277_31-05-2022.jpg', 'Stock opname', 0, 'Tazaka Room : 4', 'Tazaka Room : 4', '2022-05-31 06:46:46', '2022-05-31 06:46:58'),
(1278, '4', 81, 'Access Granted', 'storage/doorlock/doorlock_access_1278_31-05-2022.jpg', 'Mengambil barang gudang 3', 0, 'Tazaka Room : 4', 'Tazaka Room : 4', '2022-05-31 07:17:55', '2022-05-31 07:18:14'),
(1279, '6', 81, 'Access Granted', 'storage/doorlock/doorlock_access_1279_31-05-2022.jpg', '-', 0, 'Tazaka Room : 6', 'Tazaka Room : 6', '2022-05-31 07:19:59', '2022-05-31 07:20:01'),
(1280, '6', 99, 'Access Granted', 'storage/doorlock/doorlock_access_1280_31-05-2022.jpg', '-', 1, 'Tazaka Room : 6', 'Tazaka Room : 6', '2022-05-31 07:31:52', '2022-05-31 07:31:57'),
(1281, '10', 41, 'Access Granted', 'storage/doorlock/doorlock_access_1281_31-05-2022.jpg', 'Inventory tools', 0, 'Tazaka Room : 10', 'Tazaka Room : 10', '2022-05-31 07:37:16', '2022-05-31 07:37:27'),
(1282, '6', 81, 'Access Granted', 'storage/doorlock/doorlock_access_1282_31-05-2022.jpg', '-', 1, 'Tazaka Room : 6', 'Tazaka Room : 6', '2022-05-31 09:40:50', '2022-05-31 09:40:56'),
(1283, '4', 72, 'Access Granted', 'storage/doorlock/doorlock_access_1283_31-05-2022.jpg', 'Mengambil barang gudang 3', 0, 'Tazaka Room : 4', 'Tazaka Room : 4', '2022-05-31 11:36:58', '2022-05-31 11:37:18'),
(1284, '6', 31, 'Access Granted', 'storage/doorlock/doorlock_access_1284_31-05-2022.jpg', '-', 1, 'Tazaka Room : 6', 'Tazaka Room : 6', '2022-05-31 13:37:59', '2022-05-31 13:38:04'),
(1285, '10', 41, 'Access Granted', 'storage/doorlock/doorlock_access_1285_31-05-2022.jpg', 'Mengambil Bor', 0, 'Tazaka Room : 10', 'Tazaka Room : 10', '2022-05-31 15:17:50', '2022-05-31 15:17:58'),
(1286, '10', 41, 'Access Granted', 'storage/doorlock/doorlock_access_1286_31-05-2022.jpg', 'Inventory tools', 0, 'Tazaka Room : 10', 'Tazaka Room : 10', '2022-05-31 16:39:38', '2022-05-31 16:39:51'),
(1287, '10', 43, 'Access Granted', 'storage/doorlock/doorlock_access_1287_31-05-2022.jpg', '-', 0, 'Tazaka Room : 10', 'Tazaka Room : 10', '2022-05-31 19:13:54', '2022-05-31 19:13:55'),
(1288, '10', 43, 'Access Granted', 'storage/doorlock/doorlock_access_1288_31-05-2022.jpg', 'Mengambil Bor', 0, 'Tazaka Room : 10', 'Tazaka Room : 10', '2022-05-31 19:13:59', '2022-05-31 19:14:08'),
(1289, '4', 56, 'Access Granted', 'storage/doorlock/doorlock_access_1289_31-05-2022.jpg', 'Mengambil barang gudang 3', 0, 'Tazaka Room : 4', 'Tazaka Room : 4', '2022-05-31 20:20:00', '2022-05-31 20:20:14'),
(1290, '4', 56, 'Access Granted', 'storage/doorlock/doorlock_access_1290_31-05-2022.jpg', 'Mengambil barang gudang 3', 0, 'Tazaka Room : 4', 'Tazaka Room : 4', '2022-05-31 20:23:35', '2022-05-31 20:23:47'),
(1291, '4', 56, 'Access Granted', 'storage/doorlock/doorlock_access_1291_31-05-2022.jpg', 'Mengambil barang gudang 3', 0, 'Tazaka Room : 4', 'Tazaka Room : 4', '2022-05-31 20:25:44', '2022-05-31 20:25:57'),
(1292, '10', 42, 'Access Granted', 'storage/doorlock/doorlock_access_1292_31-05-2022.jpg', 'Inventory tools', 0, 'Tazaka Room : 10', 'Tazaka Room : 10', '2022-05-31 20:50:03', '2022-05-31 20:50:12'),
(1293, '10', 42, 'Access Granted', 'storage/doorlock/doorlock_access_1293_01-06-2022.jpg', 'Inventory tools', 0, 'Tazaka Room : 10', 'Tazaka Room : 10', '2022-06-01 01:11:08', '2022-06-01 01:11:17'),
(1294, '4', 56, 'Access Granted', 'storage/doorlock/doorlock_access_1294_01-06-2022.jpg', 'Mengambil barang gudang 3', 0, 'Tazaka Room : 4', 'Tazaka Room : 4', '2022-06-01 03:09:34', '2022-06-01 03:09:46'),
(1295, '4', 56, 'Access Granted', 'storage/doorlock/doorlock_access_1295_01-06-2022.jpg', 'Stock opname', 0, 'Tazaka Room : 4', 'Tazaka Room : 4', '2022-06-01 06:43:38', '2022-06-01 06:43:54'),
(1296, '4', 31, 'Access Granted', 'storage/doorlock/doorlock_access_1296_01-06-2022.jpg', 'Stock opname', 0, 'Tazaka Room : 4', 'Tazaka Room : 4', '2022-06-01 07:02:11', '2022-06-01 07:02:56'),
(1297, '6', 54, 'Access Granted', 'storage/doorlock/doorlock_access_1297_01-06-2022.jpg', '-', 0, 'Tazaka Room : 6', 'Tazaka Room : 6', '2022-06-01 09:14:38', '2022-06-01 09:14:40'),
(1298, '6', 54, 'Access Granted', 'storage/doorlock/doorlock_access_1298_01-06-2022.jpg', '-', 0, 'Tazaka Room : 6', 'Tazaka Room : 6', '2022-06-01 09:14:48', '2022-06-01 09:14:50'),
(1299, '6', 31, 'Access Granted', 'storage/doorlock/doorlock_access_1299_01-06-2022.jpg', '-', 0, 'Tazaka Room : 6', 'Tazaka Room : 6', '2022-06-01 13:04:10', '2022-06-01 13:04:11'),
(1300, '4', 54, 'Access Granted', 'storage/doorlock/doorlock_access_1300_01-06-2022.jpg', 'Stock opname', 0, 'Tazaka Room : 4', 'Tazaka Room : 4', '2022-06-01 16:57:20', '2022-06-01 16:57:30'),
(1301, '4', 56, 'Access Granted', 'storage/doorlock/doorlock_access_1301_01-06-2022.jpg', 'Mengambil barang gudang 3', 1, 'Tazaka Room : 4', 'Tazaka Room : 4', '2022-06-01 19:14:48', '2022-06-01 19:15:15'),
(1302, '4', 56, 'Access Granted', 'storage/doorlock/doorlock_access_1302_01-06-2022.jpg', 'Mengambil barang gudang 3', 0, 'Tazaka Room : 4', 'Tazaka Room : 4', '2022-06-01 20:15:44', '2022-06-01 20:16:02'),
(1303, '10', 45, 'Access Granted', 'storage/doorlock/doorlock_access_1303_01-06-2022.jpg', '-', 0, 'Tazaka Room : 10', 'Tazaka Room : 10', '2022-06-01 22:21:54', '2022-06-01 22:21:55'),
(1304, '10', 45, 'Access Granted', 'storage/doorlock/doorlock_access_1304_01-06-2022.jpg', '-', 0, 'Tazaka Room : 10', 'Tazaka Room : 10', '2022-06-01 22:21:59', '2022-06-01 22:22:00'),
(1305, '10', 45, 'Access Granted', 'storage/doorlock/doorlock_access_1305_01-06-2022.jpg', 'Mengambil Bor', 1, 'Tazaka Room : 10', 'Tazaka Room : 10', '2022-06-01 22:22:10', '2022-06-01 22:22:40'),
(1306, '6', 36, 'Access Granted', 'storage/doorlock/doorlock_access_1306_02-06-2022.jpg', '-', 0, 'Tazaka Room : 6', 'Tazaka Room : 6', '2022-06-02 00:15:12', '2022-06-02 00:15:14'),
(1307, '10', 43, 'Access Granted', 'storage/doorlock/doorlock_access_1307_02-06-2022.jpg', '-', 0, 'Tazaka Room : 10', 'Tazaka Room : 10', '2022-06-02 01:15:50', '2022-06-02 01:15:52'),
(1308, '10', 43, 'Access Granted', 'storage/doorlock/doorlock_access_1308_02-06-2022.jpg', 'Mengambil Bor', 0, 'Tazaka Room : 10', 'Tazaka Room : 10', '2022-06-02 01:15:55', '2022-06-02 01:16:01'),
(1309, '10', 43, 'Access Granted', 'storage/doorlock/doorlock_access_1309_02-06-2022.jpg', '-', 0, 'Tazaka Room : 10', 'Tazaka Room : 10', '2022-06-02 06:12:22', '2022-06-02 06:12:23'),
(1310, '10', 43, 'Access Granted', 'storage/doorlock/doorlock_access_1310_02-06-2022.jpg', 'Mengambil Bor', 1, 'Tazaka Room : 10', 'Tazaka Room : 10', '2022-06-02 06:12:26', '2022-06-02 06:12:41'),
(1311, '4', 56, 'Access Granted', 'storage/doorlock/doorlock_access_1311_02-06-2022.jpg', 'Stock opname', 0, 'Tazaka Room : 4', 'Tazaka Room : 4', '2022-06-02 06:12:33', '2022-06-02 06:12:41'),
(1312, '4', 31, 'Access Granted', 'storage/doorlock/doorlock_access_1312_02-06-2022.jpg', 'Stock opname', 0, 'Tazaka Room : 4', 'Tazaka Room : 4', '2022-06-02 06:55:09', '2022-06-02 06:56:20'),
(1313, '10', 30, 'Access Granted', 'storage/doorlock/doorlock_access_1313_02-06-2022.jpg', 'Inventory tools', 0, 'Tazaka Room : 10', 'Tazaka Room : 10', '2022-06-02 07:07:30', '2022-06-02 07:07:41'),
(1314, '6', 81, 'Access Granted', 'storage/doorlock/doorlock_access_1314_02-06-2022.jpg', '-', 0, 'Tazaka Room : 6', 'Tazaka Room : 6', '2022-06-02 09:55:37', '2022-06-02 09:55:38'),
(1315, '6', 80, 'Access Granted', 'storage/doorlock/doorlock_access_1315_02-06-2022.jpg', '-', 0, 'Tazaka Room : 6', 'Tazaka Room : 6', '2022-06-02 13:05:03', '2022-06-02 13:05:05'),
(1316, '4', 54, 'Access Granted', 'storage/doorlock/doorlock_access_1316_02-06-2022.jpg', 'Stock opname', 0, 'Tazaka Room : 4', 'Tazaka Room : 4', '2022-06-02 13:05:32', '2022-06-02 13:05:42'),
(1317, '10', 41, 'Access Granted', 'storage/doorlock/doorlock_access_1317_02-06-2022.jpg', 'Inventory tools', 0, 'Tazaka Room : 10', 'Tazaka Room : 10', '2022-06-02 13:57:06', '2022-06-02 13:57:17'),
(1318, '10', 32, 'Access Granted', 'storage/doorlock/doorlock_access_1318_02-06-2022.jpg', '-', 0, 'Tazaka Room : 10', 'Tazaka Room : 10', '2022-06-02 19:13:27', '2022-06-02 19:13:28'),
(1319, '4', 36, 'Access Granted', 'storage/doorlock/doorlock_access_1319_02-06-2022.jpg', 'Stock opname', 0, 'Tazaka Room : 4', 'Tazaka Room : 4', '2022-06-02 19:16:09', '2022-06-02 19:16:33'),
(1320, '10', 42, 'Access Granted', 'storage/doorlock/doorlock_access_1320_02-06-2022.jpg', 'Inventory tools', 0, 'Tazaka Room : 10', 'Tazaka Room : 10', '2022-06-02 19:48:32', '2022-06-02 19:48:42'),
(1321, '10', 32, 'Access Granted', 'storage/doorlock/doorlock_access_1321_02-06-2022.jpg', 'Inventory tools', 0, 'Tazaka Room : 10', 'Tazaka Room : 10', '2022-06-02 20:01:08', '2022-06-02 20:01:18'),
(1322, '10', 65, 'Access Granted', 'storage/doorlock/doorlock_access_1322_02-06-2022.jpg', 'Inventory tools', 0, 'Tazaka Room : 10', 'Tazaka Room : 10', '2022-06-02 22:24:58', '2022-06-02 22:25:16'),
(1323, '4', 56, 'Access Granted', 'storage/doorlock/doorlock_access_1323_02-06-2022.jpg', 'Mengambil barang gudang 3', 0, 'Tazaka Room : 4', 'Tazaka Room : 4', '2022-06-02 22:56:19', '2022-06-02 22:56:32'),
(1324, '10', 32, 'Access Granted', 'storage/doorlock/doorlock_access_1324_02-06-2022.jpg', 'Mengambil Bor', 0, 'Tazaka Room : 10', 'Tazaka Room : 10', '2022-06-02 23:13:09', '2022-06-02 23:13:18'),
(1325, '4', 36, 'Access Granted', 'storage/doorlock/doorlock_access_1325_03-06-2022.jpg', 'Mengambil barang gudang 3', 0, 'Tazaka Room : 4', 'Tazaka Room : 4', '2022-06-03 02:32:40', '2022-06-03 02:32:55'),
(1326, '4', 56, 'Access Granted', 'storage/doorlock/doorlock_access_1326_03-06-2022.jpg', 'Mengambil barang gudang 3', 0, 'Tazaka Room : 4', 'Tazaka Room : 4', '2022-06-03 05:29:51', '2022-06-03 05:30:04'),
(1327, '10', 42, 'Access Granted', 'storage/doorlock/doorlock_access_1327_03-06-2022.jpg', 'Inventory tools', 0, 'Tazaka Room : 10', 'Tazaka Room : 10', '2022-06-03 05:33:52', '2022-06-03 05:34:09'),
(1328, '4', 54, 'Access Granted', 'storage/doorlock/doorlock_access_1328_03-06-2022.jpg', 'Stock opname', 0, 'Tazaka Room : 4', 'Tazaka Room : 4', '2022-06-03 07:05:37', '2022-06-03 07:05:48'),
(1329, '6', 80, 'Access Granted', 'storage/doorlock/doorlock_access_1329_03-06-2022.jpg', '-', 1, 'Tazaka Room : 6', 'Tazaka Room : 6', '2022-06-03 07:10:09', '2022-06-03 07:10:14'),
(1330, '10', 30, 'Access Granted', 'storage/doorlock/doorlock_access_1330_03-06-2022.jpg', 'Inventory tools', 0, 'Tazaka Room : 10', 'Tazaka Room : 10', '2022-06-03 07:42:26', '2022-06-03 07:42:47'),
(1331, '4', 54, 'Access Granted', 'storage/doorlock/doorlock_access_1331_03-06-2022.jpg', 'Mengambil barang gudang 3', 0, 'Tazaka Room : 4', 'Tazaka Room : 4', '2022-06-03 12:59:17', '2022-06-03 12:59:32'),
(1332, '6', 81, 'Access Granted', 'storage/doorlock/doorlock_access_1332_03-06-2022.jpg', '-', 1, 'Tazaka Room : 6', 'Tazaka Room : 6', '2022-06-03 14:09:04', '2022-06-03 14:09:09'),
(1333, '6', 81, 'Access Granted', 'storage/doorlock/doorlock_access_1333_03-06-2022.jpg', '-', 1, 'Tazaka Room : 6', 'Tazaka Room : 6', '2022-06-03 14:10:12', '2022-06-03 14:10:18'),
(1334, '10', 73, 'Access Granted', 'storage/doorlock/doorlock_access_1334_03-06-2022.jpg', 'Inventory tools', 1, 'Tazaka Room : 10', 'Tazaka Room : 10', '2022-06-03 14:11:35', '2022-06-03 14:11:50'),
(1335, '10', 73, 'Access Granted', 'storage/doorlock/doorlock_access_1335_03-06-2022.jpg', '-', 0, 'Tazaka Room : 10', 'Tazaka Room : 10', '2022-06-03 14:11:51', '2022-06-03 14:11:53'),
(1336, '10', 39, 'Access Granted', 'storage/doorlock/doorlock_access_1336_03-06-2022.jpg', '-', 0, 'Tazaka Room : 10', 'Tazaka Room : 10', '2022-06-03 14:14:09', '2022-06-03 14:14:11'),
(1337, '10', 39, 'Access Granted', 'storage/doorlock/doorlock_access_1337_03-06-2022.jpg', 'Inventory tools', 0, 'Tazaka Room : 10', 'Tazaka Room : 10', '2022-06-03 14:14:33', '2022-06-03 14:14:43'),
(1338, '10', 29, 'Access Granted', 'storage/doorlock/doorlock_access_1338_03-06-2022.jpg', 'Inventory tools', 1, 'Tazaka Room : 10', 'Tazaka Room : 10', '2022-06-03 14:29:01', '2022-06-03 14:29:20'),
(1339, '10', 35, 'Access Granted', 'storage/doorlock/doorlock_access_1339_03-06-2022.jpg', 'Mengambil Bor', 0, 'Tazaka Room : 10', 'Tazaka Room : 10', '2022-06-03 14:35:07', '2022-06-03 14:35:18'),
(1340, '10', 97, 'Access Granted', 'storage/doorlock/doorlock_access_1340_03-06-2022.jpg', 'Inventory tools', 0, 'Tazaka Room : 10', 'Tazaka Room : 10', '2022-06-03 14:48:35', '2022-06-03 14:48:50'),
(1341, '10', 97, 'Access Granted', 'storage/doorlock/doorlock_access_1341_03-06-2022.jpg', 'Inventory tools', 0, 'Tazaka Room : 10', 'Tazaka Room : 10', '2022-06-03 14:53:27', '2022-06-03 14:53:45'),
(1342, '10', 104, 'Access Granted', 'storage/doorlock/doorlock_access_1342_03-06-2022.jpg', 'Inventory tools', 0, 'Tazaka Room : 10', 'Tazaka Room : 10', '2022-06-03 14:56:40', '2022-06-03 14:56:51'),
(1343, '10', 93, 'Access Granted', 'storage/doorlock/doorlock_access_1343_03-06-2022.jpg', 'Inventory tools', 0, 'Tazaka Room : 10', 'Tazaka Room : 10', '2022-06-03 14:57:12', '2022-06-03 14:57:22'),
(1344, '10', 88, 'Access Granted', 'storage/doorlock/doorlock_access_1344_03-06-2022.jpg', 'Inventory tools', 0, 'Tazaka Room : 10', 'Tazaka Room : 10', '2022-06-03 15:03:13', '2022-06-03 15:03:35'),
(1345, '10', 74, 'Access Granted', 'storage/doorlock/doorlock_access_1345_03-06-2022.jpg', 'Inventory tools', 0, 'Tazaka Room : 10', 'Tazaka Room : 10', '2022-06-03 15:04:30', '2022-06-03 15:04:43'),
(1346, '10', 75, 'Access Granted', 'storage/doorlock/doorlock_access_1346_03-06-2022.jpg', 'Inventory tools', 0, 'Tazaka Room : 10', 'Tazaka Room : 10', '2022-06-03 15:13:01', '2022-06-03 15:13:11'),
(1347, '10', 87, 'Access Granted', 'storage/doorlock/doorlock_access_1347_03-06-2022.jpg', 'Inventory tools', 0, 'Tazaka Room : 10', 'Tazaka Room : 10', '2022-06-03 15:14:42', '2022-06-03 15:14:52'),
(1348, '10', 87, 'Access Granted', 'storage/doorlock/doorlock_access_1348_03-06-2022.jpg', 'Mengambil Bor', 0, 'Tazaka Room : 10', 'Tazaka Room : 10', '2022-06-03 15:15:07', '2022-06-03 15:15:24'),
(1358, '10', 95, 'Access Granted', 'storage/doorlock/doorlock_access_1358_03-06-2022.jpg', 'Inventory tools', 1, 'Tazaka Room : 10', 'Tazaka Room : 10', '2022-06-03 15:26:29', '2022-06-03 15:26:42'),
(1359, '10', 95, 'Access Granted', 'storage/doorlock/doorlock_access_1359_03-06-2022.jpg', '-', 0, 'Tazaka Room : 10', 'Tazaka Room : 10', '2022-06-03 15:26:57', '2022-06-03 15:26:59'),
(1360, '10', 95, 'Access Granted', 'storage/doorlock/doorlock_access_1360_03-06-2022.jpg', 'Inventory tools', 0, 'Tazaka Room : 10', 'Tazaka Room : 10', '2022-06-03 15:27:31', '2022-06-03 15:27:55'),
(1365, '10', 44, 'Access Granted', 'storage/doorlock/doorlock_access_1365_03-06-2022.jpg', '-', 0, 'Tazaka Room : 10', 'Tazaka Room : 10', '2022-06-03 15:29:35', '2022-06-03 15:29:37'),
(1366, '10', 44, 'Access Granted', 'storage/doorlock/doorlock_access_1366_03-06-2022.jpg', '-', 0, 'Tazaka Room : 10', 'Tazaka Room : 10', '2022-06-03 15:29:40', '2022-06-03 15:29:42'),
(1367, '10', 44, 'Access Granted', 'storage/doorlock/doorlock_access_1367_03-06-2022.jpg', '-', 0, 'Tazaka Room : 10', 'Tazaka Room : 10', '2022-06-03 15:29:50', '2022-06-03 15:29:52'),
(1368, '10', 44, 'Access Granted', 'storage/doorlock/doorlock_access_1368_03-06-2022.jpg', '-', 0, 'Tazaka Room : 10', 'Tazaka Room : 10', '2022-06-03 15:29:55', '2022-06-03 15:29:57'),
(1369, '10', 44, 'Access Granted', 'storage/doorlock/doorlock_access_1369_03-06-2022.jpg', '-', 0, 'Tazaka Room : 10', 'Tazaka Room : 10', '2022-06-03 15:30:10', '2022-06-03 15:30:12'),
(1370, '10', 44, 'Access Granted', 'storage/doorlock/doorlock_access_1370_03-06-2022.jpg', '-', 0, 'Tazaka Room : 10', 'Tazaka Room : 10', '2022-06-03 15:30:15', '2022-06-03 15:30:17'),
(1371, '10', 44, 'Access Granted', 'storage/doorlock/doorlock_access_1371_03-06-2022.jpg', '-', 0, 'Tazaka Room : 10', 'Tazaka Room : 10', '2022-06-03 15:30:20', '2022-06-03 15:30:22'),
(1372, '10', 44, 'Access Granted', 'storage/doorlock/doorlock_access_1372_03-06-2022.jpg', '-', 0, 'Tazaka Room : 10', 'Tazaka Room : 10', '2022-06-03 15:30:25', '2022-06-03 15:30:27'),
(1373, '10', 44, 'Access Granted', 'storage/doorlock/doorlock_access_1373_03-06-2022.jpg', '-', 0, 'Tazaka Room : 10', 'Tazaka Room : 10', '2022-06-03 15:30:30', '2022-06-03 15:30:31'),
(1374, '10', 44, 'Access Granted', 'storage/doorlock/doorlock_access_1374_03-06-2022.jpg', 'Mengambil Bor', 0, 'Tazaka Room : 10', 'Tazaka Room : 10', '2022-06-03 15:30:35', '2022-06-03 15:30:41'),
(1375, '10', 94, 'Access Granted', 'storage/doorlock/doorlock_access_1375_03-06-2022.jpg', 'Inventory tools', 0, 'Tazaka Room : 10', 'Tazaka Room : 10', '2022-06-03 15:34:49', '2022-06-03 15:34:58'),
(1376, '10', 105, 'Access Granted', 'storage/doorlock/doorlock_access_1376_03-06-2022.jpg', 'Mengambil Bor', 0, 'Tazaka Room : 10', 'Tazaka Room : 10', '2022-06-03 15:59:48', '2022-06-03 15:59:57'),
(1377, '11', 105, 'Access Granted', NULL, '-', 0, 'Tazaka Room : 11', 'Tazaka Room : 11', '2022-06-03 16:00:12', '2022-06-03 16:00:12'),
(1378, '10', 106, 'Access Granted', 'storage/doorlock/doorlock_access_1378_03-06-2022.jpg', 'Mengambil Bor', 1, 'Tazaka Room : 10', 'Tazaka Room : 10', '2022-06-03 16:00:24', '2022-06-03 16:00:38'),
(1379, '11', 106, 'Access Granted', NULL, '-', 1, 'Tazaka Room : 11', 'Tazaka Room : 11', '2022-06-03 16:00:41', '2022-06-03 16:00:47'),
(1380, '10', 33, 'Access Granted', 'storage/doorlock/doorlock_access_1380_03-06-2022.jpg', 'Inventory tools', 0, 'Tazaka Room : 10', 'Tazaka Room : 10', '2022-06-03 16:01:49', '2022-06-03 16:02:02'),
(1381, '10', 30, 'Access Granted', 'storage/doorlock/doorlock_access_1381_03-06-2022.jpg', 'Inventory tools', 0, 'Tazaka Room : 10', 'Tazaka Room : 10', '2022-06-03 16:10:24', '2022-06-03 16:10:34'),
(1382, '4', 36, 'Access Granted', 'storage/doorlock/doorlock_access_1382_03-06-2022.jpg', 'Mengambil barang gudang 3', 0, 'Tazaka Room : 4', 'Tazaka Room : 4', '2022-06-03 19:19:52', '2022-06-03 19:20:02'),
(1383, '10', 65, 'Access Granted', 'storage/doorlock/doorlock_access_1383_03-06-2022.jpg', 'Mengambil Bor', 1, 'Tazaka Room : 10', 'Tazaka Room : 10', '2022-06-03 19:25:20', '2022-06-03 19:25:36'),
(1384, '4', 56, 'Access Granted', 'storage/doorlock/doorlock_access_1384_03-06-2022.jpg', 'Mengambil barang gudang 3', 0, 'Tazaka Room : 4', 'Tazaka Room : 4', '2022-06-03 19:46:09', '2022-06-03 19:46:19'),
(1385, '10', 65, 'Access Granted', 'storage/doorlock/doorlock_access_1385_03-06-2022.jpg', 'Mengambil Bor', 0, 'Tazaka Room : 10', 'Tazaka Room : 10', '2022-06-03 21:27:52', '2022-06-03 21:28:04'),
(1386, '10', 65, 'Access Granted', 'storage/doorlock/doorlock_access_1386_04-06-2022.jpg', 'Mengambil Bor', 0, 'Tazaka Room : 10', 'Tazaka Room : 10', '2022-06-04 00:29:28', '2022-06-04 00:29:51'),
(1387, '10', 43, 'Access Granted', 'storage/doorlock/doorlock_access_1387_04-06-2022.jpg', '-', 0, 'Tazaka Room : 10', 'Tazaka Room : 10', '2022-06-04 06:41:58', '2022-06-04 06:41:59'),
(1388, '10', 43, 'Access Granted', 'storage/doorlock/doorlock_access_1388_04-06-2022.jpg', 'Mengambil Bor', 0, 'Tazaka Room : 10', 'Tazaka Room : 10', '2022-06-04 06:42:03', '2022-06-04 06:42:08'),
(1389, '4', 31, 'Access Granted', 'storage/doorlock/doorlock_access_1389_04-06-2022.jpg', 'Mengambil barang gudang 3', 0, 'Tazaka Room : 4', 'Tazaka Room : 4', '2022-06-04 06:56:58', '2022-06-04 06:57:18'),
(1390, '10', 35, 'Access Granted', 'storage/doorlock/doorlock_access_1390_04-06-2022.jpg', 'Inventory tools', 0, 'Tazaka Room : 10', 'Tazaka Room : 10', '2022-06-04 08:11:18', '2022-06-04 08:11:28'),
(1391, '10', 97, 'Access Granted', 'storage/doorlock/doorlock_access_1391_04-06-2022.jpg', 'Inventory tools', 0, 'Tazaka Room : 10', 'Tazaka Room : 10', '2022-06-04 08:24:31', '2022-06-04 08:24:41'),
(1392, '4', 54, 'Access Granted', 'storage/doorlock/doorlock_access_1392_04-06-2022.jpg', 'Stock opname', 0, 'Tazaka Room : 4', 'Tazaka Room : 4', '2022-06-04 12:58:05', '2022-06-04 12:58:16'),
(1393, '10', 90, 'Access Granted', 'storage/doorlock/doorlock_access_1393_04-06-2022.jpg', 'Inventory tools', 0, 'Tazaka Room : 10', 'Tazaka Room : 10', '2022-06-04 13:18:31', '2022-06-04 13:18:41'),
(1394, '10', 90, 'Access Granted', 'storage/doorlock/doorlock_access_1394_04-06-2022.jpg', 'Inventory tools', 0, 'Tazaka Room : 10', 'Tazaka Room : 10', '2022-06-04 13:18:57', '2022-06-04 13:19:09'),
(1395, '10', 96, 'Access Granted', 'storage/doorlock/doorlock_access_1395_04-06-2022.jpg', '-', 0, 'Tazaka Room : 10', 'Tazaka Room : 10', '2022-06-04 13:26:55', '2022-06-04 13:26:56'),
(1396, '6', 96, 'Access Granted', 'storage/doorlock/doorlock_access_1396_04-06-2022.jpg', '-', 1, 'Tazaka Room : 6', 'Tazaka Room : 6', '2022-06-04 13:28:48', '2022-06-04 13:28:53'),
(1397, '6', 96, 'Access Granted', 'storage/doorlock/doorlock_access_1397_04-06-2022.jpg', '-', 0, 'Tazaka Room : 6', 'Tazaka Room : 6', '2022-06-04 13:29:09', '2022-06-04 13:29:12'),
(1398, '6', 96, 'Access Granted', 'storage/doorlock/doorlock_access_1398_04-06-2022.jpg', '-', 0, 'Tazaka Room : 6', 'Tazaka Room : 6', '2022-06-04 13:29:21', '2022-06-04 13:29:22'),
(1399, '6', 96, 'Access Granted', 'storage/doorlock/doorlock_access_1399_04-06-2022.jpg', '-', 0, 'Tazaka Room : 6', 'Tazaka Room : 6', '2022-06-04 13:29:30', '2022-06-04 13:29:32'),
(1400, '6', 81, 'Access Granted', 'storage/doorlock/doorlock_access_1400_04-06-2022.jpg', '-', 0, 'Tazaka Room : 6', 'Tazaka Room : 6', '2022-06-04 14:35:12', '2022-06-04 14:35:14'),
(1401, '4', 72, 'Access Granted', 'storage/doorlock/doorlock_access_1401_04-06-2022.jpg', '-', 0, 'Tazaka Room : 4', 'Tazaka Room : 4', '2022-06-04 14:36:50', '2022-06-04 14:36:51'),
(1402, '4', 72, 'Access Granted', 'storage/doorlock/doorlock_access_1402_04-06-2022.jpg', 'Mengambil barang gudang 3', 1, 'Tazaka Room : 4', 'Tazaka Room : 4', '2022-06-04 14:37:06', '2022-06-04 14:37:25'),
(1403, '4', 36, 'Access Granted', 'storage/doorlock/doorlock_access_1403_04-06-2022.jpg', 'Stock opname', 0, 'Tazaka Room : 4', 'Tazaka Room : 4', '2022-06-04 19:22:57', '2022-06-04 19:23:11'),
(1404, '10', 42, 'Access Granted', 'storage/doorlock/doorlock_access_1404_04-06-2022.jpg', 'Inventory tools', 0, 'Tazaka Room : 10', 'Tazaka Room : 10', '2022-06-04 20:11:34', '2022-06-04 20:11:44'),
(1405, '10', 43, 'Access Granted', 'storage/doorlock/doorlock_access_1405_04-06-2022.jpg', '-', 0, 'Tazaka Room : 10', 'Tazaka Room : 10', '2022-06-04 22:01:42', '2022-06-04 22:01:44'),
(1406, '10', 43, 'Access Granted', 'storage/doorlock/doorlock_access_1406_04-06-2022.jpg', 'Mengambil Bor', 0, 'Tazaka Room : 10', 'Tazaka Room : 10', '2022-06-04 22:01:51', '2022-06-04 22:01:55'),
(1407, '10', 42, 'Access Granted', 'storage/doorlock/doorlock_access_1407_05-06-2022.jpg', 'Inventory tools', 0, 'Tazaka Room : 10', 'Tazaka Room : 10', '2022-06-05 06:40:45', '2022-06-05 06:40:54'),
(1408, '4', 31, 'Access Granted', 'storage/doorlock/doorlock_access_1408_06-06-2022.jpg', 'Stock opname', 0, 'Tazaka Room : 4', 'Tazaka Room : 4', '2022-06-06 07:02:38', '2022-06-06 07:03:16'),
(1409, '10', 32, 'Access Granted', 'storage/doorlock/doorlock_access_1409_06-06-2022.jpg', 'Inventory tools', 0, 'Tazaka Room : 10', 'Tazaka Room : 10', '2022-06-06 07:35:14', '2022-06-06 07:35:23'),
(1410, '10', 43, 'Access Granted', 'storage/doorlock/doorlock_access_1410_06-06-2022.jpg', '-', 0, 'Tazaka Room : 10', 'Tazaka Room : 10', '2022-06-06 07:44:17', '2022-06-06 07:44:19'),
(1411, '10', 43, 'Access Granted', 'storage/doorlock/doorlock_access_1411_06-06-2022.jpg', 'Mengambil Bor', 0, 'Tazaka Room : 10', 'Tazaka Room : 10', '2022-06-06 07:44:22', '2022-06-06 07:44:31'),
(1412, '10', 43, 'Access Granted', 'storage/doorlock/doorlock_access_1412_06-06-2022.jpg', '-', 0, 'Tazaka Room : 10', 'Tazaka Room : 10', '2022-06-06 07:53:58', '2022-06-06 07:54:00'),
(1413, '10', 43, 'Access Granted', 'storage/doorlock/doorlock_access_1413_06-06-2022.jpg', 'Mengambil Bor', 0, 'Tazaka Room : 10', 'Tazaka Room : 10', '2022-06-06 07:54:03', '2022-06-06 07:54:08'),
(1414, '10', 30, 'Access Granted', 'storage/doorlock/doorlock_access_1414_06-06-2022.jpg', 'Inventory tools', 0, 'Tazaka Room : 10', 'Tazaka Room : 10', '2022-06-06 10:30:37', '2022-06-06 10:30:46'),
(1415, '6', 81, 'Access Granted', 'storage/doorlock/doorlock_access_1415_06-06-2022.jpg', '-', 1, 'Tazaka Room : 6', 'Tazaka Room : 6', '2022-06-06 10:36:36', '2022-06-06 10:36:42'),
(1416, '6', 81, 'Access Granted', 'storage/doorlock/doorlock_access_1416_06-06-2022.jpg', '-', 0, 'Tazaka Room : 6', 'Tazaka Room : 6', '2022-06-06 10:37:01', '2022-06-06 10:37:03'),
(1417, '10', 45, 'Access Granted', 'storage/doorlock/doorlock_access_1417_06-06-2022.jpg', 'Inventory tools', 0, 'Tazaka Room : 10', 'Tazaka Room : 10', '2022-06-06 10:43:20', '2022-06-06 10:43:32'),
(1418, '10', 45, 'Access Granted', 'storage/doorlock/doorlock_access_1418_06-06-2022.jpg', 'Inventory tools', 0, 'Tazaka Room : 10', 'Tazaka Room : 10', '2022-06-06 10:54:18', '2022-06-06 10:54:26'),
(1419, '10', 42, 'Access Granted', 'storage/doorlock/doorlock_access_1419_06-06-2022.jpg', 'Inventory tools', 0, 'Tazaka Room : 10', 'Tazaka Room : 10', '2022-06-06 11:23:43', '2022-06-06 11:23:54'),
(1420, '10', 42, 'Access Granted', 'storage/doorlock/doorlock_access_1420_06-06-2022.jpg', 'Inventory tools', 0, 'Tazaka Room : 10', 'Tazaka Room : 10', '2022-06-06 11:24:37', '2022-06-06 11:24:45'),
(1421, '4', 56, 'Access Granted', 'storage/doorlock/doorlock_access_1421_06-06-2022.jpg', 'Stock opname', 0, 'Tazaka Room : 4', 'Tazaka Room : 4', '2022-06-06 12:04:07', '2022-06-06 12:04:16'),
(1422, '4', 56, 'Access Granted', 'storage/doorlock/doorlock_access_1422_06-06-2022.jpg', 'Mengambil barang gudang 3', 0, 'Tazaka Room : 4', 'Tazaka Room : 4', '2022-06-06 12:10:58', '2022-06-06 12:11:06'),
(1423, '10', 32, 'Access Granted', 'storage/doorlock/doorlock_access_1423_06-06-2022.jpg', 'Inventory tools', 0, 'Tazaka Room : 10', 'Tazaka Room : 10', '2022-06-06 13:04:42', '2022-06-06 13:04:51'),
(1424, '10', 32, 'Access Granted', 'storage/doorlock/doorlock_access_1424_06-06-2022.jpg', 'Inventory tools', 0, 'Tazaka Room : 10', 'Tazaka Room : 10', '2022-06-06 13:42:58', '2022-06-06 13:43:06'),
(1425, '6', 60, 'Access Granted', 'storage/doorlock/doorlock_access_1425_06-06-2022.jpg', '-', 1, 'Tazaka Room : 6', 'Tazaka Room : 6', '2022-06-06 13:44:53', '2022-06-06 13:44:58'),
(1426, '10', 33, 'Access Granted', 'storage/doorlock/doorlock_access_1426_06-06-2022.jpg', 'Inventory tools', 0, 'Tazaka Room : 10', 'Tazaka Room : 10', '2022-06-06 13:54:29', '2022-06-06 13:54:43'),
(1427, '10', 32, 'Access Granted', 'storage/doorlock/doorlock_access_1427_06-06-2022.jpg', 'Inventory tools', 0, 'Tazaka Room : 10', 'Tazaka Room : 10', '2022-06-06 14:30:05', '2022-06-06 14:30:18'),
(1428, '10', 29, 'Access Granted', 'storage/doorlock/doorlock_access_1428_06-06-2022.jpg', '-', 0, 'Tazaka Room : 10', 'Tazaka Room : 10', '2022-06-06 19:15:07', '2022-06-06 19:15:09'),
(1429, '10', 29, 'Access Granted', 'storage/doorlock/doorlock_access_1429_06-06-2022.jpg', 'Inventory tools', 0, 'Tazaka Room : 10', 'Tazaka Room : 10', '2022-06-06 19:15:28', '2022-06-06 19:15:42'),
(1430, '10', 35, 'Access Granted', 'storage/doorlock/doorlock_access_1430_06-06-2022.jpg', '-', 0, 'Tazaka Room : 10', 'Tazaka Room : 10', '2022-06-06 19:18:25', '2022-06-06 19:18:27'),
(1431, '10', 29, 'Access Granted', 'storage/doorlock/doorlock_access_1431_06-06-2022.jpg', '-', 0, 'Tazaka Room : 10', 'Tazaka Room : 10', '2022-06-06 22:02:16', '2022-06-06 22:02:18'),
(1432, '10', 29, 'Access Granted', 'storage/doorlock/doorlock_access_1432_06-06-2022.jpg', 'Mengambil Bor', 0, 'Tazaka Room : 10', 'Tazaka Room : 10', '2022-06-06 22:02:40', '2022-06-06 22:02:50'),
(1433, '10', 73, 'Access Granted', 'storage/doorlock/doorlock_access_1433_07-06-2022.jpg', 'Inventory tools', 0, 'Tazaka Room : 10', 'Tazaka Room : 10', '2022-06-07 01:20:10', '2022-06-07 01:20:20'),
(1434, '4', 99, 'Access Granted', 'storage/doorlock/doorlock_access_1434_07-06-2022.jpg', 'Stock opname', 0, 'Tazaka Room : 4', 'Tazaka Room : 4', '2022-06-07 01:25:59', '2022-06-07 01:26:06'),
(1435, '4', 54, 'Access Granted', 'storage/doorlock/doorlock_access_1435_07-06-2022.jpg', 'Stock opname', 0, 'Tazaka Room : 4', 'Tazaka Room : 4', '2022-06-07 07:16:16', '2022-06-07 07:16:25'),
(1436, '10', 65, 'Access Granted', 'storage/doorlock/doorlock_access_1436_07-06-2022.jpg', 'Mengambil Bor', 0, 'Tazaka Room : 10', 'Tazaka Room : 10', '2022-06-07 07:21:18', '2022-06-07 07:21:33'),
(1437, '10', 60, 'Access Granted', 'storage/doorlock/doorlock_access_1437_07-06-2022.jpg', '-', 0, 'Tazaka Room : 10', 'Tazaka Room : 10', '2022-06-07 07:29:53', '2022-06-07 07:29:55'),
(1438, '10', 60, 'Access Granted', 'storage/doorlock/doorlock_access_1438_07-06-2022.jpg', '-', 0, 'Tazaka Room : 10', 'Tazaka Room : 10', '2022-06-07 07:29:59', '2022-06-07 07:30:01'),
